index,Song name,type,artist,lyrics
1, नीले नीले अम्बर पर,romantic,किशोर कुमार,नीले नीले अम्बर पर चाँद जब आये प्यार बरसाए हमको तरसाए   नीले नीले अम्बर पर चाँद जब आये प्यार बरसाए हमको तरसाए  ऐसा कोई साथी हो ऐसा कोई प्रेमी हो प्यास दिल की बुझा जाए  ऊँचे ऊँचे पर्बत जब चुमते हैं अम्बर को प्यासा-प्यासा अम्बर जब चूमता है सागर को प्यार से कसने को बाहों में बसने को दिल मेरा ललचाये कोई तो आ जाए  ऐसा कोई साथी हो ऐसा कोई प्रेमी हो प्यास दिल की बुझा जाए  ठन्डे-ठन्डे झोंके जब बालों को सहलाएं तपती-तपती किरणें जब गलों को छू जाए साँसों की गर्मी को हांथों की नरमी को मेरा मन तरसाए कोई तो छू जाए  ऐसा कोई साथी हो ऐसा कोई प्रेमी हो प्यास दिल की बुझा जाए  छम छम करता सावन बूंदों के बाण चलाए सतरंगी बरसातों में जब तनमन भीगा जाए प्यार में नहाने को डूब ही जाने को दिल मेरा तडपाये ख़्वाब जगा जाए  ऐसा कोई साथी हो ऐसा कोई प्रेमी हो प्यास दिल की बुझा जाए  नीले नीले अम्बर पर चाँद जब आये प्यार बरसाए हमको तरसाए
2,अक्कड़ बक्कड़,party,बादशाह,"अक्कड़ बक्कड़ बॉम्बे बो 80, 90 पुरे 100 रात के बज गए पौने दो जो होता है होने दो अक्कड़ बक्कड़ बॉम्बे बो 80, 90 पुरे 100 रात के बज गए पौने दो जो होता है होने दो अक्कड़ बक्कड़ बॉम्बे बो 80, 90 पुरे 100 रात के बज गए पौने दो जो होता है होने दो अक्कड़ बक्कड़ बॉम्बे बो 80, 90 पुरे 100 रात के बज गए पौने दो जो होता है होने दो  अक्कड़ बक्कड़ अक्कड़ बक्कड़ अक्कड़ बक्कड़ अक्कड़ बक्कड़..  कुड़ी तू इक लोनली नाचे हौली हौली पिके बस पेग दो तू ऐसे क्यों है डोली कुडियां दा गैंग ते मुंडियां दी टोली काफी कुछ होगा बट स्लो्ली स्लो्ली     नाच नाच के थक गया हूँ दारु पीके अक् गया हूँ मुझको निन्नी आ रही है साथ में अपने सोने दो  अक्कड़ बक्कड़ बॉम्बे बो 80, 90 पुरे 100 रात के बज गए पौने दो जो होता है होने दो अक्कड़ बक्कड़ बॉम्बे बो 80, 90 पुरे 100 रात के बज गए पौने दो जो होता है होने दो   अक्कड़ बक्कड़ अक्कड़ बक्कड़ अक्कड़ बक्कड़ अक्कड़ बक्कड़..  ये ना सोचेयो तू की, हूँ मैं तेरे आंटी बट तेरी जुबांन चलती है जैसे केंची क्लब में आई हूँ बस पार्टी करने तू क्यों फालतू में हुआ फिरता है सेंटी  चल यहाँ से टॉप ले तू रास्ता अपना नाप ले तू मीटर मेरा हिल गया तो कान के निचे दूँगी दो  अक्कड़ बक्कड़ बॉम्बे बो 80, 90 पुरे 100 रात के बज गए पौने दो जो होता है होने दो अक्कड़ बक्कड़ बॉम्बे बो 80, 90 पुरे 100 रात के बज गए पौने दो जो होता है होने दो अक्कड़ बक्कड़ बॉम्बे बो 80, 90 पुरे 100 रात के बज गए पौने दो जो होता है होने दो अक्कड़ बक्कड़ बॉम्बे बो 80, 90 पुरे 100 रात के बज गए पौने दो जो होता है होने दो  अक्कड़ बक्कड़ अक्कड़ बक्कड़ अक्कड़ बक्कड़ अक्कड़ बक्कड़.. अक्कड़ बक्कड़ अक्कड़ बक्कड़ अक्कड़ बक्कड़ अक्कड़ बक्कड़..  अक्कड़ बक्कड़ बॉम्बे बो 80, 90 पुरे 100 रात के बज गए पौने दो जो होता है होने दो.."
3,अखियाँ,sad,पोपोन,ओ थक गेया अँखियाँ ओ जग्ग दियाँ अखियाँ माहियाँ ना आया लभदियाँ अँखियाँहाये प्यार दियाँ क़समाँ खा के छड़ गया तू इश्क़ भुला के दस्स जा तू मेरा की क़ुसूर वे तू अखियाँ नू कहने दे तू अखियाँ नू बहने दे जो दर्द सतावें तेनू ना दिल विच रहने दे  तू ग़ल्ल कन्नु समझावे प्यार किन्ना तड़पावे जब तक ना आवे माही तू अखियाँ नू रोने दे  ल ला ला ला..  तेरे वे तेरे इंतेज़ार में दिल हो गया फ़क़ीरा प्यार में तुझको भुला ही ना जा सके मिट जावाँ ना मैं सब कुछ हार के  माही बिना दिल डूबदा जावे माही बिना एंनु चीन ना आवे विख जावे मेनू सोहना यार वे  तू अँखियाँ नू कहने दे तू अखियाँ नू बहने दे जो दर्द सतावे तेनू ना दिल विच रहने दे  तू ग़ल्ल कन्नु समझावे प्यार किन्ना तड़पावे जब तक ना आवे माही तू अखियाँ नू रोने दे  ओ थक गिया अँखियाँ ओ जग दियाँ अँखियाँ माहिया ना आया लभदियाँ अँखियाँ
4,अंग से अंग लगाना,romantic,"अलका याग्निक, बिनोद राठौड़, सुदेश भोसले"," अरे जो जी में आए.. अरे जो जी में आए.. तुम आज कर लो चाहो जिसे इन बाँहो में भर लो अंग से अंग लगाना सजन हमें ऐसे रंग लगाना अंग से अंग लगाना सजन हमें ऐसे रंग लगाना गालों से ये गाल लगा के नैनों से ये नैन मिला के होली आज मनाना सजन हमें ऐसे रंग लगाना  अंग से अंग लगाना सजन हमें ऐसे रंग लगाना अंग से अंग लगाना सजन हमें ऐसे रंग लगाना     ऊपर ऊपर रंग लगय्यो, ना करिओ कुछ नीचे मोसे कुछ ना बोल, खड़ी रे चुप से अँखियाँ मीचे  हो बच के पड़ोसन जाने ना पाए जाये तो वापस आने ना पाए  जुलमी ने ऐसे बाजू मरोड़ा कजरा ना गजरा, कुछ भी ना छोड़ा  रपट लिखा दो.. रपट लिखा दो थाने में हम भर देंगे जुर्माना  अंग से अंग लगाना सजन हमें ऐसे रंग लगाना अंग से अंग लगाना सजन हमें ऐसे रंग लगाना  हो रंग बरसे भीगे चुनरवाली रंग बरसे हो रंग बरसे भीगे चुनरवाली रंग बरसे हो रंग बरसे भीगे चुनरवाली रंग बरसे  अंग से, अंग से.. अंग से अंग लगाना सजन हमें ऐसे रंग लगाना अंग से अंग लगाना सजन हमें ऐसे रंग लगाना  भीगे भीगे तेरे तन से, जैसे शोले लपक रहे हैं अपना रस्ता देख मुसाफिर, तेरे नैनों भटक रहे हैं मैं भूला रास्ता, रस्ते पे आजा मैं थाम लूं बैय्याँ, मत छेड़ो सैय्याँ तुम दिल मत तोड़ो, तुम आँचल छोड़ो तुम काहे रूठी हाँ, मेरी चूड़ी टूटी दिल मेरा टूटा, चल हट जा झूठा तू नाच मैं गाऊं, तू बैठ मैं जाऊं मुश्किल है जाना, तू है दीवाना मुझे अंग लगा ले, बस रंग लगा ले नीला के पीला, नीला न पीला क्या लाल गुलाबी, तु बोल ओ भाभी  चुटकी भर सिन्दूर मंगाकर, इसकी मांग सजाना हे.. अंग से, अंग लगाना सजन हमें ऐसे रंग लगाना अंग से अंग लगाना सजन हमें ऐसे रंग लगाना अंग से अंग लगाना सजन हमें ऐसे रंग लगाना "
5,अगर ज़िन्दगी हो,romantic,आशा भोसले,अगर ज़िन्दगी हो तो तेरे संग हो अगर ज़िन्दगी हो तो तेरे संग हो अगर मौत हो तो वो हो तुझसे पहले अगर मौत हो तो वो हो तुझसे पहले अगर ज़िन्दगी हो तो तेरे संग हो अगर ज़िन्दगी हो तो तेरे संग हो अगर मौत हो तो वो हो तुझसे पहले अगर मौत हो तो वो हो तुझसे पहले बलमा.. बलमा.. बलमा.. बलमा.. अब दिल लगता कही ना तेरे बिना अब दिल लगता कही ना तेरे बिना मुश्किल होगा जीना तेरे बिना आ मिलके वादा करले जब तक होगा दम में दम साथ नहीं छोड़ेंगे चाहे खुशियाँ हो या गम बलमा.. बलमा.. बलमा.. बलमा..  अगर ज़िन्दगी हो तो तेरे संग हो अगर ज़िन्दगी हो तो तेरे संग हो   मुझको मिली है सांसे तेरे लिए मुझको मिली है सांसे तेरे लिए ख्वाब सजाये आँखें तेरे लिए अब ना कभी रूठे ये तेरे वादों का मौसम हिन्दीट्रैक्स मेरी यादों में महके तेरे यादों का मौसम बलमा.. बलमा.. बलमा.. बलमा..  अगर ज़िन्दगी हो तो तेरे संग हो अगर ज़िन्दगी हो तो तेरे संग हो  जब तक ये दुनियां ये आलम रहे जब तक ये दुनियां ये आलम रहे प्यार तेरा इस दिल में बालम रहे मेरे प्यासे दिल पे ना कोई दूजा रंग चढ़े कम ना हो हर लम्हा तेरी चाहत और बढ़े बलमा.. बलमा.. बलमा.. बलमा..  अगर ज़िन्दगी हो तो तेरे संग हो अगर ज़िन्दगी हो तो तेरे संग हो अगर मौत हो तो वो हो तुझसे पहले अगर मौत हो तो वो हो तुझसे पहले बलमा.. बलमा.. बलमा.. बलमा..
6,अगर तुम न होते,sad,किशोर कुमार,"हमें और जीने की चाहत न होती हमें और जीने की चाहत न होती अगर तुम न होते, अगर तुम न होते हमें और जीने की चाहत न होती अगर तुम न होते, अगर तुम न होते हमें जो तुम्हारा सहारा न मिलता भंवर में ही रहते किनारा न मिलता हमें जो तुम्हारा सहारा न मिलता भंवर में ही रहते किनारा न मिलता किनारे पे भी तो लहर आ डुबोती अगर तुम न होते, अगर तुम न होते  हमें और जीने की चाहत न होती अगर तुम न होते, अगर तुम न होते  तुम्हें क्या बताऊं के तुम मेरे क्या हो मेरी ज़िंदगी का तुम ही आसरा हो तुम्हें क्या बताऊं के तुम मेरे क्या हो मेरी ज़िंदगी का तुम ही आसरा हो मैं आशा की लड़ियां, न रह-रह पिरोती अगर तुम न होते, अगर तुम न होते  हमें और जीने की चाहत न होती अगर तुम न होते, अगर तुम न होते  हर इक ग़म तुम्हारा सहेंगे खुशी से करेंगे न शिकवा कभी भी किसी से हर इक ग़म तुम्हारा सहेंगे खुशी से करेंगे न शिकवा कभी भी किसी से जहां मुझपे हंसता, खुशी मुझपे रोती अगर तुम न होते, अगर तुम न होते  हमें और जीने की चाहत न होती अगर तुम न होते, अगर तुम न होते"
7,अगर तुम मिल जाओ,romantic,श्रेया घोषाल,अगर तुम मिल जाओ ज़माना छोड़ देंगे हम अगर तुम मिल जाओ ज़माना छोड़ देंगे हम अगर तुम मिल जाओ ज़माना छोड़ देंगे हम तुम्हे पा कर ज़माने भर से रिश्ता तोड़ देंगे हम अगर तुम मिल जाओ ज़माना छोड़ देंगे हम अगर तुम मिल जाओ ज़माना छोड़ देंगे हम बिना तेरे कोई दिलकश नज़ारा हम न देखेंगे बिना तेरे कोई दिलकश नज़ारा हम न देखेंगे तुम्हे न हो पसंद उसको दोबारा हम न देखेंगे तेरी सूरत न हो जिस में तेरी सूरत न हो जिस में वह शीशा तोड़ देंगे हम अगर तुम मिल जाओ ज़माना छोड़ देंगे हम तेरे दिल में रहेंगे तुझको अपना घर बना लेंगे तेरे दिल में रहेंगे तुझको अपना घर बना लेंगे तेरे ख़्वाबों को बहेनो की तरह खुद पर सजा लेंगे कसम तेरी कसम कसम तेरी कसम तक़दीर का रोग मोड़ देंगे हम अगर तुम मिल जाओ ज़माना छोड़ देंगे हम तुम्हे हम अपने जिस्म-ो-जान में कुछ ऐसे बसा लेंगे तुम्हे हम अपने जिस्म-ो-जान में कुछ ऐसे बसा लेंगे तेरी खुशबू अपने जिस्म की खुश्बू बना लेंगे खुदा से भी न जो टूटे खुदा से भी न जो टूटे वह रिश्ता जोड़ लेंगे हम अगर तुम मिल जाओ ज़माना छोड़ देंगे हम तुम्हे पा कर ज़माने भर से रिश्ता तोड़ देंगे हम अगर तुम मिल जाओ ज़माना छोड़ देंगे हम अगर तुम मिल जाओ ज़माना छोड़ देंगे हम.
8,अगर तुम साथ हो,sad,अरिजीत सिंह,पल भर ठहर जाओ दिल ये संभल जाए कैसे तुम्हें रोका करूँ मेरी तरफ आता हर ग़म फिसल जाए आँखों में तुम को भरूं बिन बोले बातें तुमसे करूँ गर तुम साथ हो अगर तुम साथ होतेरी नज़रों में है तेरे सपने तेरे सपनों में है नाराज़ी मुझे लगता है के बातें दिल की होती लफ़्ज़ों की धोखेबाज़ी तुम साथ हो या ना हो क्या फर्क है बेदर्द थी ज़िन्दगी बेदर्द है गर तुम साथ हो अगर तुम साथ हो  पलकें झपकते दी दिन ये निकल जाए बैठी बैठी भागी फिरूँ मेरी तरफ आता हर ग़म फिसल जाए आँखों एमीन तुम को भरूं बिन बोले बातें तुमसे करूँ गर तुम साथ हो अगर तुम साथ हो  तेरी नज़रों में है तेरे सपने तेरे सपनों में है नाराज़ी मुझे लगता है के बातें दिल की होती लफ़्ज़ों की धोखेबाज़ी तुम साथ हो या ना हो क्या फर्क है बेदर्द थी ज़िन्दगी बेदर्द है  अगर तुम साथ हो दिल ये संभल जाए अगर तुम साथ हो  हर ग़म फिसल जाए अगर तुम साथ हो  दिल ये निकल जाए अगर तुम साथ हो  हर ग़म फिसल जाए
9,अजनबी मुझको इतना बता,romantic,आशा भोसले,"अजनबी मुझको इतना बता दिल मेरा क्यों परेशान है देख के तुझको ऐसा लगे जैसे बरसों की पहचान है   कितनी भोली है तू कितनी नादान है दिल की बातों से अंजान है  अजनबी मुझको इतना बता दिल मेरा क्यों परेशान है देख के तुझको ऐसा लगे जैसे बरसों की पहचान है  ओ कितनी भोली है तू कितनी नादान है दिल की बातों से अंजान है  अजनबी मुझको इतना बता दिल मेरा क्यों परेशान है  क्या सोचता हूँ, मैं क्या चाहता हूँ है मुश्किल तुझे वो बताना  मैने सुना है की मुश्किल बड़ा है दबी चाहतों को छुपाना  हे क्या सोचता हूँ, मैं क्या चाहता हूँ है मुश्किल तुझे वो बताना  ओ मैने सुना है की मुश्किल बड़ा है दबी चाहतों को छुपाना  राज़ तेरे सभी खोल देगी अभी इन लभों पे जो मुस्कान है  अजनबी मुझको इतना बता दिल मेरा क्यों परेशान है  कैसे बताऊँ मेरी धडकनों को बनाया है किसने दीवाना  ओ बेगाने को अपना कहने लगी मैं बना मेरा अपना बेगाना  हाँ कैसे बताऊँ मेरी धडकनों को बनाया है किसने दीवाना  ओ बेगाने को अपना कहने लगी मैं बना मेरा अपना बेगाना  प्यार की हर घडी मुश्किलों की लड़ी ये ना समझो ये आसान है  अजनबी मुझको इतना बता दिल मेरा क्यों परेशान है देख के तुझको ऐसा लगे जैसे बरसों की पहचान है  कितनी भोली है तू कितनी नादान है दिल की बातों से अंजान है  अजनबी मुझको इतना बता ला ला.. हम्म हम्म."
