index,Song name,type,artist,lyrics
583,माही वे,romantic,ए.आर. रहमान,"धूप पानी पे बरस जाएये साए बनाए, मिटाएमैं कहूँ, और तू आ जाए, बहलाएहर दूरी शरमाएतू साथ है, हो दिन रात हैपरछाइयाँ बतलाएतू साथ है, हर दिन रात हैसाया सा है, माही वे…माही वे…मेरी हर बात में साथ तू हैमाही वे…माही वे…मेरे सारे हालात तूमाहिए ए… ओ…हाय सताए, मनाए सताएतू रुलाए, हंसाए भी तू हीहमसाये हर दूरी शरमाएतू साथ है, हो दिन रात हैसाया सा है, माही वे, माही वेमेरी सब राज़, कल-आज, तू हैमाही वे…माही वे…मेरी हर उड़ान एक तूमाही वे…माही वे…"
584,मिल गया हमको साथी,romantic,किशोर कुमार,मिल गया हमको साथी मिल गया अब जीकर कोई जल गया ओह ओह जलने दे ओह ओह जलने दे चल गया चल गया प्यार का जादू चल गया अब जीकर कोई जल गया ओह ओह जलने दे ओह ओह जलने दे तेरे लिए जमाना तेरे लिए और तू मेरे लिए तेरे लिए जमाना तेरे लिए और तू मेरे लिए मिल गया हमको साथी मिल गया अब जीकर कोई जल गया ओह ओह जलने दे ओह ओह जलने दे तेरे लिए जमाना तेरे लिए और तू मेरे लिए तेरे लिए जमाना तेरे लिए और तू मेरे लिए
585,मिलने है मुझसे आई,sad,अरिजीत सिंह,मिलने है मुझसे आई फिर जाने क्यूँ तन्हाई किस मोड़ पे है लायी आशिक़ी ओ… ख़ुद से है या ख़ुदा से इस पल मेरी लड़ाई किस मोड़ पे है लायी आशिक़ी ओ..ओ…हो… आशिक़ी बाज़ी है ताश की टूटते बनते विश्वास की ओ..मिलने है मुझसे आई फिर जाने क्यूँ तन्हाई किस मोड़ पे है लायी आशिक़ी  जाने क्यूँ मैं सोचता हूँ खाली सा मैं.. इक रास्ता हूँ तूने मुझे कहीं खो दिया है या मैं कहीं ख़ुद लापता हूँ आ ढूँढ ले तू फिर मुझे.. कसमें भी दूं तो क्या तुझे..  आशिक़ी बाज़ी है ताश की टूटते बनते विश्वास की.. मिलने है मुझसे आई फिर जाने क्यूँ तन्हाई किस मोड़ पे है लायी आशिक़ी  टूटा हुआ साज़ हूँ मैं खुद से ही नाराज़ हूँ मैं सीने में जो कहीं पे दबी है ऐसी कोई आवाज़ हूँ मैं सुन ले मुझे तू बिन कहे.. कब तक खामोशी दिल सहे…  आशिक़ी बाज़ी है ताश की टूटते बनते विश्वास की… आशिक़ी बाज़ी है ताश की टूटते बनते विश्वास की…  ओ..मिलने है मुझसे आई फिर जाने क्यूँ तन्हाई किस मोड़ पे है लायी आशिक़ी ओ…ख़ुद से है या ख़ुदा से इस पल मेरी लड़ाई किस मोड़ पे है लायी आशिक़ी ओ..ओ…हो…ओ… आशिक़ी बाज़ी है ताश की टूटते बनते विश्वास की..
586,मिले हो तुम हमको,romantic,"नेहा कक्कर, टोनी कक्कर",मिले हो तुम हमको बड़े नसीबों सेचुराया है मैंने क़िस्मत की लकीरों सेमिले हो तुम हमको बड़े नसीबों सेचुराया है मैंने क़िस्मत की लकीरों सेतेरी मोहब्बत से साँसें मिली हैसदा रहना दिल में क़रीब रह होके मिले हो तुम हमको बड़े नसीबों सेचुराया है मैंने क़िस्मत की लकीरों से मिले हो तुम हमको बड़े नसीबों सेचुराया है मैंने क़िस्मत की लकीरों से  तेरी चाहतों में कितना तड़पे हैसावन भी कितने तुझ बिन बरसे हैज़िन्दगी में मेरी सारी जो भी कमी थीतेरे आ जाने से अब नहीं रहीसदा ही रहना तुम मेरे क़रीब हो केचुराया है मैंने क़िस्मत की लकीरों सेमिले हो तुम हमको बड़े नसीबों सेचुराया है मैंने क़िस्मत की लकीरों सेबाँहों में तेरी अब यारा जन्नत हैमाँगी ख़ुदा से तू वो मन्नत हैतेरी वफ़ा का सहारा मिला हैतेरी ही बजह से अब मैं ज़िन्दा हूँतेरी मोहब्बत से ज़रा अमीर हो केचुराया है मैंने क़िस्मत की लकीरों सेमिले हो तुम हमको बड़े नसीबों सेचुराया है मैंने क़िस्मत की लकीरों सेमिले हो तुम हमको बड़े नसीबों सेचुराया है मैंने क़िस्मत की लकीरों से
587,मुझे कैसे पता ना चला ,romantic,पोपोन,मेरे दिल में तेरी धड़कने थी मुझको ना आई नज़र तेरा इश्क मुझ में सांस ले रहा था मुझको हुई ना खबर  मेरे अलावा जान गए सब मुझपे तू किन्ना मरदा ऐ मुझे कैसे पता ना चला की तू मेनू प्यार करदा ऐ मुझे कैसे पता ना चला की मेरा ही इतेज़ार करदा ऐ  मेरे अलावा जान गए सब मुझपे तू किन्ना मरदा ऐ मुझे कैसे पता ना चला की तू मेनू प्यार करदा ऐ मुझे कैसे पता ना चला  की मेरा ही इतेज़ार करदा ऐ  तेरे बाद तुझको हम ढूंढते हैं राहों से तेरा पता पूछते हैं  मिलते है जो प्यार में आंसू रब जाने क्यूँ नहीं सूखते हैं  दूरियाँ ये तेरी छूने लगी तो जीने से दिल मेरा दर्द ऐ  मुझे कैसे पता ना चला की तू मेनू प्यार करदा ऐ मुझे कैसे पता ना चला की तू मेनू प्यार करदा ऐ  हाथों में अब तेरा हाथ नहीं है लगता लकीरें साथ नहीं हैं  तेरे बिना देखा है महसूस कर के जीने में अब वो बात नहीं है  सामने तू है सामने मैं हूँ फिर जाने कैसा पर्दा है  मुझे कैसे पता ना चला की तू मेनू प्यार करदा ऐ मुझे कैसे पता ना चला की तू मेनू प्यार करदा ऐ  मेरे अलावा जान गए सब मुझपे तू किन्ना मरदा ऐ  मुझे कैसे पता ना चला की तू मेनू प्यार करदा ऐ मुझे कैसे पता ना चला की तू मेनू प्यार करदा ऐ
588,मुझे गले से लगा लो,sad,"मोहम्मद रफ़ी, आशा भोसले","मुझे गले से लगा लो, बहुत उदास हूँ मैं    नज़र में तीर से चुभते हैं अब नजारों से  मैं थक गई हूँ सभी टूटते सहारों से  अब और बोझ ना डालो   बहुत सही, गम-ए-दुनिया, मगर उदास ना हो  करीब है शब-ए-गम की, सहर उदास ना हो  बहुत सही........   सितम के हाथ की तलवार टूट जाएगी  ये ऊंच-नीच की दिवार टूट जाएगी  तुझे कसम है मेरी हमसफ़र उदास ना हो   ना जाने कब ए तरीका ए तौर बदलेगा  सितम का गम कब मुसीबत का दौर बदलेगा  मुझे जहां से उठा लो, बहुत उदास हूँ मैं"
589,मुबारकां,party,बादशाह,"सबको ये सुन्नी शाम मुबारक है ये ख़ुशी वाला जाम मुबारक मित्रां नु ये सलाम मुबारक शाम मुबारक, जाम मुबारक  सबको ये सुन्नी शाम मुबारक है ये ख़ुशी वाला जाम मुबारक मित्रां नु ये सलाम मुबारक शाम मुबारक  आज सेलिब्रेट करेंगे किसी का ना करेंगे ओल्ड फैशन में नाचना स्टेप नया करेंगे  आजा नाच ले मेरे नाल ज़रा पुछ ले मेरे हाल आ पी ले थोड़ी थोड़ी मेरे साथ तेरी कमर पे मेरा हाथ सोहनीये  मुबारकां मुबारकां मुबारकां पार्टी वाली नाईट है मुबारकां पार्टी वाली नाईट है मुबारकां पार्टी वाली नाईट है मुबारकां   ओ हाहा बादशाह  देखो नाचना वचन मुझे आता नहीं दारु को भी मैं हाथ लगता नहीं लेकिन जो दो पेग पी लूं तो मेरे जैसा डांस कोई कर पाता नहीं  मैं हूँ बादशाह बन क्वीन बेबी तेरी कर दूं रात सोहनीये  डांस को स्पीड बढ़ा दो बजी है बीट गज़ब की देख कर देसी झटके नींद उड़ जाए सबकी  नशे में तेरी चाल है ग़लत से ये ख्याल ओ तेरे संग गुज़रे सारी रात मेरी माइंड ना करियो बात सोहनीये  मुबारकां मुबारकां मुबारकां पार्टी वाली नाईट है मुबारकां सबको ये सुन्नी शाम मुबारक है ये ख़ुशी वाला जाम मुबारक मित्रां नु ये सलाम मुबारक शाम मुबारक, जाम मुबारक सबको ये सुन्नी शाम मुबारक है ये ख़ुशी वाला जाम मुबारक मित्रां नु ये सलाम मुबारक शाम मुबारक, जाम मुबारक  मुबारकां मुबारकां मुबारकां  पार्टी वाली नाईट है मुबारकां पार्टी वाली नाईट है मुबारकां पार्टी वाली नाईट है मुबारकां पार्टी वाली नाईट है मुबारकां  पार्टी वाली नाईट है"
590,मुर्शिदा,party,अरिजीत सिंह,"पहली शर्त जुदाई है इश्क बड़ा हरजाई है दिल पे किसने दस्तक दी तुम हो या तन्हाई है तुझको भूले बैठे थे फिर से तेरी याद आई है दिल पे किसने दस्तक दी तुम हो या तन्हाई है मुर्शिदा, मुर्शिदा, मुर्शिदा अल मदद दोस्तां मुर्शिदा अलविदा, अलविदा, अलविदा अलविदा दोस्तां अलविदा सूखे फूल हैं हाथों में प्यार का मौसम चाहा था उसने ज़ख्म दिए हमको जिस से मरहम चाहा था जिस से मरहम चाहा था अबके ओस की बूंदों ने दिल में आग लगायी है दिल पे किसने दस्तक दी तुम हो या तन्हाई है मुर्शिदा, मुर्शिदा, मुर्शिदा अल मदद दोस्तां मुर्शिदा अलविदा, अलविदा, अलविदा अलविदा दोस्तां अलविदा पल पल बंजर, बंजर है आज भी तेरी ख्वाहिश है तुझसे मिले ये किस्मत थी तुझसे बिछड़ना साज़िश है तुझसे बिछड़ना साज़िश है जिसके सपने देखे थे उसने नींद उड़ाई है दिल पे किसने दस्तक दी तुम हो या तन्हाई है मुर्शिदा, मुर्शिदा, मुर्शिदा अल मदद दोस्तां मुर्शिदा अलविदा, अलविदा, अलविदा अलविदा दोस्तां अलविदा मुर्शिदा, मुर्शिदा, मुर्शिदा अल मदद दोस्तां मुर्शिदा अलविदा, अलविदा, अलविदा अलविदा दोस्तां अलविदा मुर्शिदा, मुर्शिदा, मुर्शिदा.. अल मदद दोस्तां मुर्शिदा"
591,मुस्कुराने की वज़ह तुम हो,romantic,अरिजीत सिंह,"मुस्कुराने की वज़ह तुम हो गुनगुनाने की वज़ह तुम हो जिया जाए ना,  जाए ना, जाए ना ओ रे पिया रे… ओ रे लम्हें तू कहीं मत जा हो सके तो उम्र भर थम जा जिया जाए ना, जाए ना, जाए ना ओ रे पिया रे…  जिया जाए ना, जाए ना, जाए ना ओ रे पिया रे…  पिया रे…  धुप आए तो.. छाँव तुम लाना ख़्वाहिशों की बारिशों में भीग संग जाना  जिया जाए ना, जाए ना, जाए ना ओ रे पिया रे… जिया जाए ना, जाए ना, जाए ना ओ रे पिया रे…  पिया रे… ऊऊ…"
592,मूव योर बॉडी ,party,बादशाह,बिना आँखें झपकाए देखूं तुझको बस तेरी कमर पर मेरा फोकस करे क्या प्रूब ऐसे करके तू मूव आके इतना बता दे बेबी मुझको बस बस बस बेबी  और ना होता है सबर मुझको बना ले तू अपना लोवर पुछो ना दोबारा बेबी करे जो ईशारा तुझे लेके चलूँगा सीधा अपने घर  ना ना ना बेबी ऐसे ना तू हस हो जाएगी दिक्कत गयी जो तू फस नाम मेरा बादशाह नाम बदल दियो मेरा बेबी जो ना करदी तेरी बस  मूव योर बॉडी आगे पीछे मूव योर बॉडी ऊपर मूव योर बॉडी दायें बाएं मूव योर बॉडी आये हाय मूव योर बॉडी आये हाय मूव योर बॉडी आये हाय मूव योर बॉडी बॉडी.. मूव योर बॉडी टप टप टप के है स्वेटर सारी की सारी बेबी होगई तू वेट इधर आ नखरे ना दिखा तुझको नहीं पता बेबी व्हाट यू गोंना गेट गेट.. गेट लो बेबी उह माइंड करदे ब्लो बेबी और हिला थोडा स्लो बेबी उह जाए ना मुझे कुछ हो बेबी  नाह सारे मूंडे कहंदे फायर फायर टेम्परेचर गेटिंग हायर हायर सारे मूंडे कहंदे फायर फायर टेम्परेचर गेटिंग हायर हायर  डीजे शैडो गिव द फायर फायर टेम्परेचर गेटिंग हायर हायर सील पॉल गेट द फायर फायर टेम्परेचर गेटिंग हायर हायर  मूव योर बॉडी..
593,मेड इन इंडिया ,party,अलीशा चिनाय,"देखी है सारी दुनिया जापान से लेकर रसिया ऑस्ट्रेलिया से लेके अमेरिका… देखा है प्यार का सपना दिल चाहे कोई अपना मिलजाए गर एक साथिया एक देसिया मेड इन इंडिया   एक दिल चाहिए दैट्स मेड इन इंडिया ओ हो हो इंडिया एक प्यारा सोनिया एक दिल चाहिए दैट्स मेड इन इंडिया     तन गोरा हो या काल पर हो सच्चा दिलवाला चांदी नहीं, सोना नहीं, कोई हिरा  दिल जिसका हिंदुस्तानी नहीं कोई इंग्लिश्तानी रात और दिन मुझे प्यार कोई करने वाला मेड इन इंडिया, मेड इन इंडिया  एक दिल चाहिए दैट्स मेड इन इंडिया ओ हो हो इंडिया एक प्यारा सोनिया एक दिल चाहिए दैट्स मेड इन इंडिया  कैसी है यार अमीरी कैसी दिलदार गरीबी अच्छा है क्या, क्या है बुरा मुझको पता…  देखी है सारी दुनिया जापान से लेकर रसिया ऑस्ट्रेलिया से लेके अमेरिका मेड इन इंडिया मेड इन इंडिया एक दिल चाहिए दैट्स मेड इन इंडिया ओ हो हो मेड इन इंडिया एक प्यारा सोनिया एक दिल चाहिए दैट्स मेड इन इंडिया ओ हो हो मेड इन इंडिया एक प्यारा सोनिया एक दिल चाहिए दैट्स मेड इन इंडिया"
594,मेरा इंतकाम देखेगी,sad,कृष्णा बेउरा,जो दिल में भरा तूने देखेगी उस ज़हर को भुगतेगी मेरे गम को मेरी आह के कहर को अपनी खुदगर्जी का अब अंजाम देखेगी ठुकरा के मेरा प्यार मेरा इंतकाम देखेगी ठुकरा के मेरा प्यार मेरा इंतकाम देखेगी  चाहत का सिला ज़ालिम मतलब ही दिया तूने मजबूर ना थी फिर भी धोखा किया तूने  नफरत को मेरी अब तू सुबह शाम देखेगी ठुकरा के मेरा प्यार मेरा इंतकाम देखेगी  ठुकरा के मेरा प्यार मेरा इंतकाम देखेगी..  तूने हर सितम जो मुझपे कुछ सोच के किया है कुदरत ने सिला उसका आखिर तुझे दिया है  दुनिया शिकस्त तेरी सर-ए-आम देखेगी ठुकरा के मेरा प्यार मेरा इंतकाम देखेगी ठुकरा के मेरा प्यार मेरा इंतकाम देखेगी
