index,Song_name,type,artist,lyrics
572,भुला देना,sad,मुस्तफा ज़ाहिद,भुला अलविदा जी बि सफ़र रास् जी बि शोहरत दुआ … रहमत दुआ … जी बि भुला अलविदा जी बि किनारा सहारा तर फ़स ख़ुद यक़ीन बन ख़ुदा किनारा सहारा तर फ़स ख़ुद यक़ीन बन ख़ुदा फिज़ा शाम नयी सुबह जी बि जी बि खिल … बहार … पाय रह हमारी वफ़ा … पाय मिलूँगा वादा रहूँगा संग वादा जी बि भुला अलविदा जी बि जी बि 
573,भूल जा,sad,शान,आंसू हासिल मा आसन निभ मुशकिल यार सुनले इल्तेजाभूल भूल क़सम मुस्कुरा ना सज़ा याद भूल नह वफ क़ाबिल सोच दिल दिल सौदा ना बेवजह भूल भूल क़सम मुस्कुरा ना सज़ा याद भूल ज़िन्दगी अमानत नह चाहे तोड़ अमानत नह दिल सौदा ना बेवजह भूल भूल क़सम मुस्कुरा ना सज़ा याद भूल क़सम मुस्कुरा ना सज़ा याद भूल ना ना ना ना भूल ना ना ना ना मुस्कुरा ना सज़ा याद भूल 
574,भोली सी सूरत,romantic,लता मंगेशकर,भोली सूरत आँख मस् हाय भोली सूरत आँख मस् खड़ी शर्म हाय झलक दिखलाये आँचल छुप हाय नज़र देखो यार नज़र भोली सूरत आँख मस् खड़ी शर्म हाय झलक दिखलाये आँचल छुप हाय नज़र देखो यार नज़र भोली सूरत आँख मस् हाय नह जादू रात ख्वाब जुल्फ बिखर आँख खुली दिल चाहा नींद बिन देखे हाल देखूं भोली सूरत आँख मस् खड़ी शर्म हाय झलक दिखलाये आँचल छुप हाय नज़र देखो यार नज़र भोली सूरत आँख मस् हाय ओहो सावन पहला बादल काजल मौज उठे सागर कदम उठाये रब मिट्टी अंग बनाये छम साम भोली सूरत आँख मस् खड़ी शर्म हाय झलक दिखलाये आँचल छुप हाय नज़र देखो यार नज़र भोली सूरत आँख मस् खड़ी शर्म हाय हाय 
575,मत जा रे,sad,अंकित तिवारी,तलक सू फ़लक ढूंढे किधर ना आए नज़र सुन इल्तेजा कमी सांस थमी तन्हा दिल तलक सू फ़लक ढूंढे किधर ना आए नज़र सुन इल्तेजा कमी सांस थमी तन्हा दिल रिश् आँख रिश् रिश् आँख रिश् दिल पाट बांट पिस् दिल पाट बांट पिस् ज़िद्द दिल ना झुठला कमी सांस थमी तन्हा दिल दिल इश्क़ बिंधा ज़िद्दी परिंदा दिल इश्क़ बिंधा ज़िद्दी परिंदा उम्मीद घायल उम्मीद ज़िंदा उम्मीद घायल उम्मीद ज़िंदा आस भरी अरदास ना ठुकरा कमी सांस थमी तन्हा दिल 
576,मदारी,party,विशाल ददलानी,मदारी मदारी मदारी… क्यूटी पेंचे ढील देके खेंचे लपेटूँ दिल ट्राली फ़्रम लंदन मेहरौली खेंचूँ मदारी मदारी खोलूँ जादू पिटारी मंतर मदारी मदारी खोलूँ जादू पिटारी मंतर ना समझ कैज़ूअल हेलो मीठी बात चुटकी मेलो चाँद चप चालाकी चालाकी खिला गुड संग बोल मम्मी डैडी मम्मी लौट देरी क्यूटी पेंचे ढील देके खेंचे लपेटूँ दिल ट्राली फ़्रम लंदन मेहरौली खेंचूँ मदारी मदारी खोलूँ जादू पिटारी मंतर मदारी मदारी खोलूँ जादू पिटारी मंतर कर संग हिप हॉप डान्सिंग ज़रा मौक़ा बोले टिप-टॉप रोमैन्सिंग लूट दुकान पॉश मकान दिला बैंगल आन बलमा नुकड़ वाली सलमा करूँगा हैंडल बहन टक्का हक्का बक्का कैसी दिल दिल टिंग टोंग हिल पौ कस मदारी मदारी खोले जादू पिटारी मंतर मदारी मदारी खोले जादू पिटारी मंतर 
577,मन मस्त मगन,romantic,अरिजीत सिंह,इश्क़ धुनि रोज़ जल उठ धुंआ छुप अँख हजूरी मांगे मंजूरी कजरा सियाही दिन रंग कस्तूरी रैन जग मन मस्त मगन मन मस्त मगन दोहर मन मस्त मगन मन मस्त मगन दोहर चाहे भूल ना पाए मन मस्त मगन मन मस्त मगन दोहर मन मस्त मगन मन मस्त मगन दोहर जोगिया जोग लगाके मखरा रोग इश्क़ धुनि रोज़ जल उठ धुंआ छुप मन मस्त मगन मन मस्त मगन दोहर मन मस्त मगन मन मस्त मगन दोहर चाहे भूल ना पाए मन मस्त मगन मन मस्त मगन दोहर मन मस्त मगन मन मस्त मगन दोहराएओढ़ धा रीत चादर शहर राँझा दुनिया ज़म झूठा फ़स मर वादा सांचा शीश-महल ना सुह संग सुखी रोटी भाए मन मस्त मगन मन मस्त मगन दोहर मन मस्त मगन मन मस्त मगन दोहराएचाहे भूल ना पाए मन मस्त मगन मन मस्त मगन दोहर मन मस्त मगन मन मस्त मगन दोहर 
578,मर जाएं,sad,आतिफ़ असलम,लम्हा देख इंतज़ार याद अक्सर रात रोज़ जग बदला दिल दिन पल पैदा पल नज़र ना पल पैदा पल नज़र ना गर पल पल मर जाएं मर जाएं मर जाएं मर जाएं मर जाएं जुदा तसवुर गुनाह आता भीड़ अक्सर तन्हा ख़्वाब देखले रात नींद उड़ मर जाएं मर जाएं मर जाएं मर जाएं मर जाएं मर जाएं मर जाएं मर जाएं 
579,मरीज़-ए-इश्क़,romantic,अरिजीत सिंह,मरीज़-ए-इश्क़ दवा मरीज़-ए-इश्क़ दवा होओ तलब नशा ग़ुलाम दिल खुलके ज़रा लूं साँस तलब नशा ग़ुलाम दिल खुलके ज़रा लूं साँस मरीज़-ए-इश्क़ दवा हाथ रख दिल ज़रा हाथ रख दिल ज़रा होहो रब मिल बन ना बिछड़ खुद रब मिल बन ना बिछड़ खुद मोहब्बत रूह लाज़िम रिज़ा हाथ रख दिल ज़रा हाथ रख दिल ज़रा हाथ रख दिल ज़रा होओ चाहा वफ़ा माँगा दुआ पाया अदा चाहाा वफ़ा माँगा दुआ पाया अदा करम हद ज़्यादा हाथ रख दिल ज़रा हाथ रख दिल ज़रा हाथ रख दिल ज़रा होओ 
580,मलंग,romantic,वेद शर्म,काफ़िर चल सफ़र संग काफ़िर चल सफ़र संग मंजिल ना डोर रंग मलंग मलंग मलंग मलंग मलंग मलंग मलंग मलंग मलंग मलंग हाय बैरागी साजी भटक मन बैरागी साजी भटक मन आवारा मन मलंग मलंग मलंग मलंग मलंग मलंग मलंग मलंग मलंग मलंग हाय रूबरू मुझम हिन्दी ट्रैक्स डॉट रूबरू मुझम बादल आसम पिघली रात हर्ब नम ना खुदा धरम मलंग मलंग मलंग मलंग मलंग मलंग मलंग मलंग मलंग मलंग हाय 
581,मस्ता,party,विशाल ददलानी,कहत कबीर सुनो भाई साधो मन उड़ ना बंधो फ़ेंक खुश पासा देख तमासा दाव मस् मस् कहत कबीर सुनो भाई साधो मन उड़ ना बंधो फ़ेंक खुश पासा देख तमासा दाव मस् मस् दिल जीत हार यार खेल बाजी आर पार चल देख तमासा दाव मस् मस् कहत कबीर सुनो भाई साधो मन उड़ ना बंधो फ़ेंक खुश पासा देख तमासा दाव मस् मस् हेय उड़ चली शहर गली हुयी बावली मस् दिन रात याद बात मस् दिल जीत हार यार खेल बाजी आर पार चल देख तमासा दाव मस् मस् कहत कबीर सुनो भाई साधो मन उड़ ना बंधो फ़ेंक खुश पासा देख तमासा दाव मस् टेढ़े मेढ़े रस् चल रास्त मस् इतर हँस हंस मस् टेढ़े मेढ़े रस् चल रास्त मस् इतर हँस हंस मस् दिल जीत हार यार खेल बाजी आर पार चल देख तमासा दाव मस् मस् कहत कबीर सुनो भाई साधो मन उड़ ना बंधो फ़ेंक खुश पासा देख तमासा दाव मस् मस् मस् मस् मस् 
582,महरमा,sad,दर्शन रावल,साए जगह चाहा ना दिल समझदार ना पहुँचूँ चाहूँ खो महरमा जुदा महरमा जुदा ना ख़बर ना ख़बर ना महरमा जुदा शोर हिस्सा आवाज़ लोग तनहा तनहा दुन मुझ जुदा बोलूँ ना बात नह थोड़ा सही हवा ख़फ़ा महरमा जुदा महरमा जुदा ना ख़बर ना ख़बर ना महरमा जुदा 
583,माही वे,romantic,ए.आर. रहमान,धूप पा बरस जाएये साए बन मिटाएमैं बहलाएहर दूरी शरमाएतू साथ दिन रात हैपरछ बतलाएतू साथ दिन रात हैस माही वे…माही वे…मेरी बात साथ हैमाही वे…माही वे…मेरे हालात तूमाह ए… ओ…हाय सत मन सताएतू रुल हंस हीहमसाये दूरी शरमाएतू साथ दिन रात हैस माही माही वेमेरी राज़ कल-आज हैमाही वे…माही वे…मेरी उड़ान तूमाही वे…माही वे… 
584,मिल गया हमको साथी,romantic,किशोर कुमार,मिल साथी मिल जी जल जल जल चल चल प्यार जादू चल जी जल जल जल जम जम मिल साथी मिल जी जल जल जल जम जम 
585,मिलने है मुझसे आई,sad,अरिजीत सिंह,मिल तन्ह मोड़ आशिक़ी ओ… ख़ुद ख़ुदा पल लड़ मोड़ आशिक़ी ओओ…हो… आशिक़ी बाज़ी ताश टूट बन विश्वास ओमिल तन्ह मोड़ आशिक़ी सोच खाली रास् खो ख़ुद लाप ढूँढ कसम आशिक़ी बाज़ी ताश टूट बन विश्वास मिल तन्ह मोड़ आशिक़ी टूटा साज़ नाराज़ सी दबी आवाज़ सुन बिन खामोशी दिल सहे… आशिक़ी बाज़ी ताश टूट बन विश्वास की… आशिक़ी बाज़ी ताश टूट बन विश्वास की… ओमिल तन्ह मोड़ आशिक़ी ओ…ख़ुद ख़ुदा पल लड़ मोड़ आशिक़ी ओओ…हो…ओ… आशिक़ी बाज़ी ताश टूट बन विश्वास 
586,मिले हो तुम हमको,romantic,"नेहा कक्कर, टोनी कक्कर",मिले नसीब सेचुर क़िस्मत लकीर सेमिले नसीब सेचुर क़िस्मत लकीर सेतेरी मोहब्बत साँस मिली हैसदा रह दिल क़रीब मिले नसीब सेचुर क़िस्मत लकीर मिले नसीब सेचुर क़िस्मत लकीर चाहत तड़पे हैसावन कित बिन बरसे हैज़िन्दगी कमी थीतेरे नह रहीसदा रह क़रीब केचुर क़िस्मत लकीर सेमिले नसीब सेचुर क़िस्मत लकीर सेबाँह यारा जन्नत हैमाँगी ख़ुदा मन्नत हैतेरी वफ़ा सहारा हैतेरी बजह ज़िन्दा हूँतेरी मोहब्बत ज़रा अमीर केचुर क़िस्मत लकीर सेमिले नसीब सेचुर क़िस्मत लकीर सेमिले नसीब सेचुर क़िस्मत लकीर 
587,मुझे कैसे पता ना चला ,romantic,पोपोन,दिल धड़क ना नज़र इश्क मुझ सांस ना खबर अलावा जान किन् मरदा ना चला प्यार करदा ना चला इतेज़ार करदा अलावा जान किन् मरदा ना चला प्यार करदा ना चला इतेज़ार करदा ढूंढ राह पूछ मिल प्यार आंसू रब नह सूख दूर छू दिल दर्द ना चला प्यार करदा ना चला प्यार करदा हाथ हाथ नह लकीर साथ नह बि देखा महसूस बात नह साम साम पर्दा ना चला प्यार करदा ना चला प्यार करदा अलावा जान किन् मरदा ना चला प्यार करदा ना चला प्यार करदा 
588,मुझे गले से लगा लो,sad,"मोहम्मद रफ़ी, आशा भोसले",गले उदास नज़र तीर चुभ नजार थक टूट सहार बोझ ना डालो सही गम-ए-दुनिया उदास ना करीब शब-ए-गम सहर उदास ना सही सितम हाथ तलवार टूट जाएगी ऊंच-नीच दिवार टूट जाएगी कसम हमसफ़र उदास ना ना तरीका तौर बदल सितम गम मुसीबत दौर बदल उठा उदास 
589,मुबारकां,party,बादशाह,सुन् शाम मुबारक ख़ुशी जाम मुबारक मित्र सलाम मुबारक शाम मुबारक जाम मुबारक सुन् शाम मुबारक ख़ुशी जाम मुबारक मित्र सलाम मुबारक शाम मुबारक सेलिब्रेट ना ओल्ड फैशन नाच स्टेप नया नाच नाल ज़रा पुछ हाल पी थोड़ी थोड़ी साथ कमर हाथ सोहनीये मुबारक मुबारक मुबारक पार्टी वाली नाईट मुबारक पार्टी वाली नाईट मुबारक पार्टी वाली नाईट मुबारक हाहा बादशाह देखो नाच वचन आता नह दारु हाथ नह पेग पी लूं डांस पा नह बादशाह क्वीन बेबी रात सोहनीये डांस स्पीड बढ़ा बजी बीट गज़ब देख देसी झटके नींद उड़ सबकी नशे चाल ग़लत ख्याल संग गुज़रे रात माइंड ना करियो बात सोहनीये मुबारक मुबारक मुबारक पार्टी वाली नाईट मुबारक सुन् शाम मुबारक ख़ुशी जाम मुबारक मित्र सलाम मुबारक शाम मुबारक जाम मुबारक सुन् शाम मुबारक ख़ुशी जाम मुबारक मित्र सलाम मुबारक शाम मुबारक जाम मुबारक मुबारक मुबारक मुबारक पार्टी वाली नाईट मुबारक पार्टी वाली नाईट मुबारक पार्टी वाली नाईट मुबारक पार्टी वाली नाईट मुबारक पार्टी वाली नाईट 
590,मुर्शिदा,party,अरिजीत सिंह,शर्त जुद इश्क हरज दिल किस दस्तक तन्ह भूले बैठे याद दिल किस दस्तक तन्ह मुर्शिदा मुर्शिदा मुर्शिदा अल मदद दोस्त मुर्शिदा अलविदा अलविदा अलविदा अलविदा दोस्त अलविदा सूखे फूल हाथ प्यार मौसम चाहा उस ज़ख्म मरहम चाहा मरहम चाहा अबके ओस बूंद दिल आग लगायी दिल किस दस्तक तन्ह मुर्शिदा मुर्शिदा मुर्शिदा अल मदद दोस्त मुर्शिदा अलविदा अलविदा अलविदा अलविदा दोस्त अलविदा पल पल बंजर बंजर ख्वाहिश मिले किस्मत बिछड़ साज़िश बिछड़ साज़िश जिसके सप देखे उस नींद उड़ दिल किस दस्तक तन्ह मुर्शिदा मुर्शिदा मुर्शिदा अल मदद दोस्त मुर्शिदा अलविदा अलविदा अलविदा अलविदा दोस्त अलविदा मुर्शिदा मुर्शिदा मुर्शिदा अल मदद दोस्त मुर्शिदा अलविदा अलविदा अलविदा अलविदा दोस्त अलविदा मुर्शिदा मुर्शिदा मुर्शिदा अल मदद दोस्त मुर्शिदा 
591,मुस्कुराने की वज़ह तुम हो,romantic,अरिजीत सिंह,मुस्कुर वज़ह गुनगुन वज़ह ना ना ना पिया रे… लम्ह उम्र भर थम ना ना ना पिया रे… ना ना ना पिया रे… पिया रे… धुप आए छाँव ख़्वाहिश बारिश भीग संग ना ना ना पिया रे… ना ना ना पिया रे… पिया रे… ऊऊ… 
592,मूव योर बॉडी ,party,बादशाह,बि आँख झपक देखूं कमर फोकस प्रूब आके बेबी बेबी ना सबर लोवर पुछो ना दोबारा बेबी ईशारा चलूँगा सीधा ना ना ना बेबी ना हस जाएगी दिक्कत फस बादशाह बदल दियो बेबी ना बॉडी बॉडी बॉडी दाय बाएं बॉडी हाय बॉडी हाय बॉडी हाय बॉडी बॉडी बॉडी टप टप टप स्वेटर बेबी होगई वेट इधर नखरे ना दिखा नह बेबी व्हाट गों गेट गेट गेट बेबी उह माइंड करदे ब्लो बेबी हिला स्लो बेबी उह ना बेबी नाह मूंडे कहंदे फायर फायर टेम्परेचर गेटिंग हायर हायर मूंडे कहंदे फायर फायर टेम्परेचर गेटिंग हायर हायर डीजे शैडो गिव द फायर फायर टेम्परेचर गेटिंग हायर हायर सील पॉल गेट द फायर फायर टेम्परेचर गेटिंग हायर हायर बॉडी 
