index,Song_name,type,artist,lyrics
403,दर्द-ए-डिस्को,party,"सुखविंदर सिंह, मैरिएन, निशा, कैरलिसा",हसी नीलमपरी करगई जादूगरी नींद आँख छीन हाय दिल बेचैन भरी हसी नीलमपरी करगई जादूगरी नींद आँख छीन हाय दिल बेचैन भरी बेचारा आवारा बोलो समझ दिल दर्द-ए-डिस्को दर्द-ए-डिस्को दर्द-ए-डिस्कोदिल दर्द-ए-डिस्को दर्द-ए-डिस्को दर्द-ए-डिस्कोदिल दर्द-ए-डिस्को दर्द-ए-डिस्को दर्द-ए-डिस्कोदिल दर्द-ए-डिस्को दर्द-ए-डिस्को दर्द-ए-डिस्कोदिल दर्द-ए-डिस्को दर्द-ए-डिस्को दर्द-ए-डिस्को फ़ासले गुल गुलपोश मौसम सरगोश मौसम आहा फ़ासले गुल गुलपोश मौसम सरगोश मौसम जुनून ख़्वाब अंजुमन कहूं बागपन रनीश चला फोवरा फूटा ख्वाब गुब्बारा फिर लंदन पेरिश न्यू यॉर्क सन फ्रांसिस्को दिल दर्द-ए-डिस्को दर्द-ए-डिस्को दर्द-ए-डिस्को दर्द-ए-डिस्को ome now lets go हसी नीलमपरी करगई जादूगरी नींद आँख छीन हाय दिल बेचैन भरी हसी नीलमपरी करगई जादूगरी नींद आँख छीन हाय दिल बेचैन भरी बेचारा आवारा बोलो समझ [ दिल दर्द-ए-डिस्को दर्द-ए-डिस्को दर्द-ए-डिस्को ] x ४ फ़ासले गुल गुलपोश मौसम सरगोश मौसम आहा फ़ासले गुल गुलपोश मौसम सरगोश मौसम जुनून ख़्वाब अंजुमन कहूं बागपन रनीश चला फोवरा फूटा ख्वाब गुब्बारा फिर लंदन पेरिश न्यू यॉर्क सन फ्रांसिस्को दिल दर्द-ए-डिस्को दर्द-ए-डिस्को दर्द-ए-डिस्को दर्द-ए-डिस्को ome now lets go लम्हा लम्हा अरमान फरमाइश लम्हा लम्हा जुर्रत आजमाइश थीलम्हा लम्हा अरमान फरमाइश लम्हा लम्हा जुर्रत आजमाइश थीलम्हा लम्हा अरमान फरमाइश लम्हा लम्हा जुर्रत आजमाइश अब्र-ए-करम घिर घिर बरसा अब्र-ए-करम बरसा तरसा ना मज़ार सनम दिलबर दिल तोड़ छोड़ पिछले मही छबीस दिल दर्द-ए-डिस्को दर्द-ए-डिस्को दर्द-ए-डिस्कोदिल दर्द-ए-डिस्को दर्द-ए-डिस्को दर्द-ए-डिस्कोदिल दर्द-ए-डिस्को दर्द-ए-डिस्को दर्द-ए-डिस्को हसी नीलमपरी करगई जादूगरी नींद आँख छीन हाय दिल बेचैन भरी बेचारा आवारा बोलो समझ दिल दर्द-ए-डिस्को दर्द-ए-डिस्को दर्द-ए-डिस्कोदिल दर्द-ए-डिस्को दर्द-ए-डिस्को दर्द-ए-डिस्कोदिल दर्द-ए-डिस्को दर्द-ए-डिस्को दर्द-ए-डिस्कोदिल दर्द-ए-डिस्को दर्द-ए-डिस्को दर्द-ए-डिस्कोदिल दर्द-ए-डिस्को दर्द-ए-डिस्को दर्द-ए-डिस्को अब्र-ए-करम घिर घिर बरसा अब्र-ए-करम बरसा तरसा ना मज़ार सनम दिलबर दिल तोड़ छोड़ पिछले मही छबीस दिल दर्द-ए-डिस्को दर्द-ए-डिस्को दर्द-ए-डिस्को दिल दर्द-ए-डिस्को दर्द-ए-डिस्को दर्द-ए-डिस्को दिल दर्द-ए-डिस्को दर्द-ए-डिस्को दर्द-ए-डिस्को दिल दर्द-ए-डिस्को दर्द-ए-डिस्को दर्द-ए-डिस्को दिल दर्द-ए-डिस्को दर्द-ए-डिस्को दर्द-ए-डिस्को हसी नीलमपरी करगई जादूगरी नींद आँख छीन हाय दिल बेचैन भरी बेचारा आवारा बोलो समझ दर्द-ए-डिस्को दर्द-ए-डिस्को दर्द-ए-डिस्को दर्द-ए-डिस्को दर्द-ए-डिस्को दर्द-ए-डिस्को दर्द-ए-डिस्को दर्द-ए-डिस्को दर्द-ए-डिस्को दर्द-ए-डिस्को दर्द-ए-डिस्को दर्द-ए-डिस्को दर्द-ए-डिस्को दर्द-ए-डिस्को दर्द-ए-डिस्को 
404,दर्द-ए-दिल,romantic,मोहम्मद रफ़ी,दर्द-ए-दिल दर्द-ए-जिगर दिल जग आप दर्द-ए-दिल दर्द-ए-जिगर दिल जग आप शायर शायर आशिक बन आप दर्द-ए-दिल दर्द-ए-जिगर दिल जग आप दर्द-ए-दिल दर्द-ए-जिगर दिल जग आप आपकी मदहोश नज़र शायरी आपकी मदहोश नज़र शायरी ग़ज़ल नह ग़ज़ल आपकी लिखा लिख आप दर्द-ए-दिल दर्द-ए-जिगर दिल जग आप दर्द-ए-दिल दर्द-ए-जिगर दिल जग आप खो जित परछाईय उठ यार महफ़िल तन्हाईय खो जित परछाईय उठ यार महफ़िल तन्हाईय शायद पर्दा गिर आप दर्द-ए-दिल दर्द-ए-जिगर दिल जग आप दर्द-ए-दिल दर्द-ए-जिगर दिल जग आप थोड़ी देर जुदा थोड़ी देर जुदा आपको ढूँढूँगा रास् खो नह बत आप दर्द-ए-दिल दर्द-ए-जिगर दिल जग आप शायर आशिक बन आप दर्द-ए-दिल दर्द-ए-जिगर दिल जग आप 
405,दाता सुन ले,sad,लता मंगेशकर,दा सुन मौला सुन दा सुन मौला सुन राह कांटे चुनले दरपे खड़े सर झुकाये अर्ज हमारी दा सुन मौला सुन दा सुन मौला सुन दा सुन रात काली दिन अँधेरा रात काली दिन अँधेरा पलक छांव जीवन डोरी थाम हाथ दुनिया हमारी दा सुन मौला सुन दा सुन मौला सुन दा सुन गलत माफ़ मन सच्च विश्वास भर रात गुजर आंख आँख फूल ढूंढ़ काँट भरी शाख साँस धर हमरी पाप पर्वत भारी दा सुन मौला सुन दा सुन मौला सुन दा सुन मौला सुन मौला सुन दा सुन मौला सुन 
406,दायरे,sad,अरिजीत सिंह,दिल मोहब्बत बांधे हाय दिल मोहब्बत बांधे हाय दायरेदायरेदायरेदायरे फ़ासले दरम फ़ासले दरम दायरे दायरे दायरे दायरे कांच ख़्वाब नाज़ुक छू टूट मन्नत उम्र भर साथ जिनका माँगा हमसफ़र छूट ना मर मुनासिब ना ना मर मुनासिब ना हाय दायरे दायरे दायरे दायरे ना ना 
407,दारू विच प्यार,party,ताज़,कड पटियाला जवा करदे शुरू कहा देसी छोरा नचा इंग्लिश रा मच शोर म्यूजिक जोर स्टाइल क्रेजी ब्रिंग इट बेक साज [ दारू प्यार दारू प्यार नशे बोतल नशे बोतल ] x मंजिल तक़दीर नाल ज़िन्दगी कमी प्यार जाम पिला दिल नाल दिल हुस्न रानिये महबूब अँख प्यास बुझा अँख प्यास बुझा बुझा दारू प्यार दारू प्यार साज चूमे बेकाबू व्हाट हुस्न नशा जि मौन फंसा tell me baby kya मैडनेस चार बोतल मदद क्लब मयख बिल्लो दीव कसम खुदा बिल्लो जान प्यारी लग्गे तेर अदाव करदा सलामी इश्क वाल्लाह एह्दा रूप वल्लाह चरेय दिल कमज़ोर अँख प्यास बुझा अँख प्यास बुझा बुझा दारू प्यार दारू प्यार 
408,दिन ढल जाए हाय,sad,मोहम्मद रफ़ी,आ… दिन ढल हाय रात ना ना याद सत दिन ढल हाय रात ना ना याद सत दिन ढल प्यार जिनके जग छोड़ा बदनाम हाथ हाल बैठे दिल थाम पराये दिन ढल जाए… रिमझीम पुहारे बरसात जुदा जग पराये साथ सावन ना दिन ढल जाए… दिल पास कित दिल परेशान मजबूर मनाये दिन ढल हाय रात ना ना याद सत दिन ढल 
409,दिल ऐसा किसी ने,sad,किशोर कुमार,दिल तोड़ा बर्बादी मोड़ा दिल तोड़ा बर्बादी मोड़ा भले मानुष अमानुष छोड़ा दिल तोड़ा बर्बादी मोड़ा सागर पास जीवन प्यास सागर पास जीवन प्यास प्यास बड़ी जीवन थोड़ा अमानुष छोड़ा … दुनिया रास् मंज़िल नह वास् दुनिया रास् मंज़िल नह वास् नाकाम ना जोड़ा अमानुष छोड़ा … डूबा सूरज निकले रह नह अँधेरा सूरज रूठा देखा सवेरा उजाल साथ छोड़ा अमानुष छोड़ा दिल तोड़ा … 
410,दिल कहता है,sad,"कुमार सानू, अल्का याग्निक
",दिल कह चल उनसे मिल उठ कदम रुक दिल समझ दिल समझ दिल कह चल उनसे मिल उठ कदम रुक दिल समझ दिल समझ जुदा हमनश देखो दामन नह दौलत चाँद शोहरत चांद खो नह नह जानो दिल दिल पछत हिन्दीट्रैक्स दिल समझ दिल समझ दिन हस साथ बाह आपकी हाथ सनम दिन रात बुलंदी ना दामन हाथ पा मुमकिन नह सोचे घबर दिल समझ दिल समझ दिल कह चल उनसे मिल उठ कदम रुक उठ कदम रुक उठ कदम रुक 
411,दिल का क्या करे साहिब,sad,कविता कृष्णामूर्ति,सोच भुलादे सोच याद करले धिनक दिन दिन दिन धिनक दिन फर्याद करले दिल साहिब दिल साहिब उन्ही मर दिल साहिब उन्ही मर जुर्म जुर्म जुर्म उनसे प्यार दिल साहिब उन्ही मर दिल साहिब धिनक दिन दिन दिन धिनक दिन ध धिनक दिन दिन दिन धिनक दिन ध बेकरारी दर्द पागल ऐन मिल चैन खो नज़र इश्क़ समंदर जाके इल्तेजा मौज मार जानके ना लग लगन शीशा तोड़ दिल साहिब दिल साहिब उन्ही मर जुर्म जुर्म जुर्म जुर्म उनसे प्यार दिल साहिब धिनक दिन दिन दिन धिनक दिन ध धिनक दिन दिन दिन धिनक दिन ध वफ़ा दीवान किस रोका झूठे वाडे लोग झूठे रसमे लाहा असर सद सभ मोहब्बत नाकाम चाहत गुज़ारा नह गाल दिल काअरे दिल दिल साहिब उन्ही मर जुर्म जुर्म जुर्म जुर्म उनसे प्यार दिल साहिब साहिब साहिब सहिब साहिब उन्ही मर दिल साहिब 
412,दिल का हाल,romantic,जुबिन नौटियाल ,दिल हाल कहूं छुप दिल हाल कहूं छुप सुनले यूं बात सुन ना प्यार कहूं भला दिल हाल कहूं छुप नह नह आँख देख चेहरा लग चेहरे बेग दिल हाल कहूं छुप दिल पागल समझे नह मांग दिल पागल समझे नह मांग चाहे सोचे पा ना ज़िन्दगी ज़िन्दगी मान दिल हाल कहूं छुप सुनले यूं बात सुन ना प्यार कहूं भला दिल हाल कहूं छुप 
413,दिल क्या करे,romantic,किशोर कुमार,दिल प्यार प्यार दिल प्यार प्यार ऊँची ऊँची दीवार दुनिया रस्म ऊँची ऊँची दीवार दुनिया रस्म ना जूली ना दिल पर्वत घटा झुक सागर लगर उठ होजैसे पर्वत घटा झुक सागर लगर उठ चेहरे निगाह रूक रोक नह नज़र दुनिया भर रस्म ना जूली ना दिल याद भुला दुनिया तस्वीर याद भुला दुनिया तस्वीर दिल चिर दिखा दौड़ साथ लहू प्यार नस-नस ना जूली ना दिल 
414,दिल क्यों ये मेरा,romantic,के.के.,दिल शोर दिल शोर इधर नह उधर नह दिल शोर इधर नह उधर नह देर नज़र मिल खो देर नज़र मिल खो भीड़ लोग प्यार मेले अकेला दिल शोर इधर नह उधर नह शुरू कहा दिल बात ना मनी शुरू कहा दिल बात ना मनी हद गुजर परेशान दिल शोर दिल शोर इधर नह उधर नह 
415,दिल चीज़ क्या है,romantic,आशा भोसले,दिल चीज़ जान लीजिये मान लीजिये अंजुमन आपको बार-बार दीवार-ओ-दर गौर पहचान लीजिये दिल चीज़ मा दोस्त नह दोस् पास गैर अहसान लीजिये दिल चीज़ कहिये आसम ज़म उतार लाएं मुश्किल नह ठान लीजिये दिल चीज़ 
416,दिल चोरी,party,"यो यो हनी सिंह, सिमर कौर, इशर्स
",हनी सिंग सुनो रात कहा पी रेड वाइन पुरा लाख रोका यार ना मनमानीसुनो रात कहा पी रेड वाइन पुरा लाख रोका यार ना मनमा मिली अप्सरा केन्ह्दी मनु कोल अप्सरा दिल लाप दिल चोरी साडा दिल चोरी साडा नैन खो मैडम चाल सिल्की सिल्की बाल इससे कहूं नशे टल्ली दिल चोरी साडा मुंडे कुड मिल क्रेजी फ्ल्वोर आय मिल नोट उड़ाय ज़ूम विडियो बनवाय यार cousin et s celebrate pre-wedding shagan ढूढ दिल कुंवारा जिसके दिल लगन कईओं होंगे रिश् पक्के जिनके नैन मटक्के अख सीधी उत् रखे दस दिल चोरी साडा नैन खो मैडम चाल सिल्की सिल्की बाल इससे कहूं नशे टल्ली दिल चोरी साडा रात दारु खींच वेडिंग यार come party with me धीरे कहो जू छुपाय छुपाय छितर खाय सुपर माहोल बन बुआ फूफड़ नच मस् ज़ोर रह पी कह पंजाबी वेडिंग लड़क पट दारु चल खुल्ली बट दारू चली जाएगी कैटरिंग वाल सामत आएगी दिल चोरी साडा दिल चोरी साडा नैन खो मैडम चाल सिल्की सिल्की बाल इससे कहूं नशे टल्ली दिल चोरी साडा हनी सिंग 
417,दिल जानिये,romantic,जुबिन नौटियाल ,सच मोहब्बत निभावांगा रांझेयान कहलावांगा वारी दिल लग जाणे दिल करार बण जावांगा सच मोहब्बतन निभावांगी हीरिये कहलावांगी वारी दिल लग जाणे दिल करार बण जावांगी इल्तेजा दिल पहल इश्क़ दिल जानिये लैण लफ्ज़-ए-मोहब्बत लैण दिल जानिये लैण लफ्ज़-ए-मोहब्बत लैण दिन रात देखा आँख चाहत दिन रात देखा आँख चाहत क़ैद लक़ीर साथ क़िस्मत जीत हार पहल प्यार दिल जानिये लैण लफ्ज़-ए-मोहब्बत लैण दिल जानिये लैण लफ्ज़-ए-मोहब्बत लैण रब वसदा दिल इबादत रब वसदा दिल इबादत नज़दीक़ ना बेवजह हौले हौले दिल खो दिल जानिये लैण लफ्ज़-ए-मोहब्बत लैण दिल जानिये लैण लफ्ज़-ए-मोहब्बत लैण 
418,दिल टुटा रोये नैना,sad,आशा भोसले,दिल टुटा रोये नै दिल टुटा रोये नै प्यार समझ देखि बेवफ दिलदार समझ दिल टुटा रोये नै दिल जले दर्द अंगारो दिल जले दर्द अंगारो बेख़ होक शामिल हु खटवारो दिल सितम मोहब्बत जुर्म सर्कार समझ दिल टुटा रोये नै प्यार समझ दिल टुटा रोये नै बदला प्यार अहसान बदला प्यार अहसान किस्सा अधूरा अरमान सप संसार समझ दिल टुटा रोये नै प्यार समझ देखि बेवफ दिलदार समझ दिल टुटा रोये नै 
419,दिल तू ही बता,romantic,"अलीशा चिनाय, ज़ुबेन गर्ग
",दिल छुपा सु धड़कन दिल छुपा सु धड़कन दिल सुन दिल पुकार दिल पुकार दिल छुपा सु धड़कन दिल सुन दिल पुकार दुनिया झूठी लग दुनिया झूठी लग सप सच्चा छुप बाह अच्छा हवा लहर दिल सुन दिल पुकार दिल बाह फ़लक बाह फ़लक जन्नत ज़मीन लग प्यार चीज़ हस लग दिल खो दिल चला चली चली प्यार गली वफ़ा सद चली चली प्यार गली वफ़ा सद दिल सुन दिल पुकार दिल छुपा सु धड़कन दिल सुन दिल पुकार 
