index,Song name,type,artist,lyrics
383,तेरे जैसा,romantic,"तुलसी कुमार, सचेत टनड़न",तेरे जैसा मुझको बना दे मेरा ना दूजा कोई संत और पीर हुवे सब रब के संत और पीर हुवे सब रब के मैं तो तेरी होई तेरे जैसा मुझको बना दे मेरा ना दूजा कोई..  मुझे बस यार यार इक बार-बार रब तू है तो दिला दे सब वार वार हर बार बार मेरे यार यार से मिला दे   मुझे बस यार यार इक बार-बार रब तू है तो दिला दे सब वार वार हर बार बार मेरे यार यार से मिला दे  मैं जहां जहां गया वहाँ बसर फ़िज़ूल था बस एक तेरी उन्ही निगाहों को हमेशा ढूंढता मेरे रात की सुबह मेरे दर्द की दवा ना ज़मीन ना आसमां हो हमारे दरमियां  तेरे जैसा मुझको बना दे मेरा ना दूजा कोई  मुझे बस यार यार इक बार-बार रब तू है तो दिला दे सब वार वार हर बार बार मेरे यार यार से मिला दे
384,तेरे जैसा यार कहाँ,party,किशोर कुमार,तेरे जैसा यार कहाँ कहाँ ऐसा याराना याद करेगी दुनियां तेरा मेरा अफसाना तेरे जैसा यार कहाँ कहाँ ऐसा याराना याद करेगी दुनियां तेरा मेरा अफसाना मेरी ज़िन्दगी सवारी मुझको गले लगाके बैठा दिया फलक पे मुझे ख़ाक से उठाके मेरी ज़िन्दगी सवारी मुझको गले लगाके बैठा दिया फलक पे मुझे ख़ाक से उठाके यारा तेरी यारी को मैने तो खुदा माना याद करेगी दुनियां तेरा मेरा अफसाना  मेरे दिल की ये दुआ है कभी दूर तू न जाए तेरे बिना हो जीना वो दिन कभी न आये मेरे दिल की ये दुआ है कभी दूर तू न जाए तेरे बिना हो जीना वो दिन कभी न आये तेरे संग जीना यहाँ तेरे संग मर जाना याद करेगी दुनियां तेरा मेरा अफसाना  तेरे जैसा यार कहाँ कहा ऐसा याराना याद करेगी दुनियां तेरा मेरा अफसाना
385,तेरे दर्द से,sad,कुमार सानू,तेरे दर्द से दिल आबाद रहा तेरे दर्द से दिल आबाद रहा कुछ भूल गए कुछ याद रहा कुछ याद रहा  तेरे दर्द से दिल आबाद रहा कुछ भूल गए कुछ याद रहा कुछ याद रहा  नसीबा भी क्या रंग लाया कहाँ लाके हमको मिलाया नसीबा भी क्या रंग लाया कहाँ लाके हमको मिलाया  अपनी वफ़ा ले गुल खिल ना पाए मिलके भी तुझसे हम मिल ना पाए दर्द-ए-दिल हम कैसे सहे दूर भी हम कैसे रहे  तेरे दर्द से दिल आबाद रहा तेरे दर्द से दिल आबाद रहा कुछ भूल गए कुछ याद रहा कुछ याद रहा  जान-ए-वफ़ा तुझको क्या दे दिल कह रहा है दुआ दें जान-ए-वफ़ा तुझको क्या दे दिल कह रहा है दुआ दें  अरमान बुझे हैं सपने धुंआ हैं मर मर के हम तो ज़िंदा यहाँ हैं बेखुदी में हम खो गए फिर जुदा तुझसे हो गए  चाहत का जहां बर्बाद रहा चाहत का जहां बर्बाद रहा कुछ भूल गए कुछ याद रहा कुछ याद रहा  तेरे दर्द से दिल आबाद रहा कुछ भूल गए कुछ याद रहा कुछ याद रहा  तेरे दर्द से दिल आबाद रहा कुछ भूल गए कुछ याद रहा कुछ याद रहा  तेरे दर्द से दिल आबाद रहा कुछ भूल गए कुछ याद रहा कुछ याद रहा
386,तेरे नाम,sad,अलका याग्निक,"ला ला ला तेरे नाम हम ने किया हैजीवन अपना सारा सनमहो.. जीवन अपना सारा सनमतेरे नाम ला ला लातेरे नाम ला ला लातेरे नाम हम ने किया हैजीवन अपना सारा सनमहो.. जीवन अपना सारा सनमप्यार बहुत करते है तुमसेइश्क़ है तू हमारा सनमहो.. इश्क़ है तू हमारा सनमला ला ला ला लाला लाला ला ला ला लाला ला ला ला लाला ला ला ला ला ला ला ला ला ला ला लातेरे इश्क़ ने साथियातेरा हाल क्या कर दियातेरे इश्क़ ने साथियातेरा हाल क्या कर दियागुलशन भी अब तो बिराना लगता हैहर अपना हमको बेगाना लगता हैहम तो तेरी यादों में खोये रहते हैंलोग हमें पागल दीवाना कहते हैंतेरे बिना, तेरे बिनातेरे बिना नामुमकिन हैज़िन्दगी का गुजरा सनमहो.. ज़िन्दगी का गुजरा सनमलागी छुटे ना, लागी छुटे नालागी छुटे ना, इश्क का घागा टूटे नालागी छुटे ना, लागी छुटे नालागी छुटे ना, इश्क का घागा टूटे नातेरे इश्क़ ने साथियातेरा हाल क्या कर दियातेरे इश्क़ ने साथियातेरा हाल क्या कर दियानैनो से बहते अश्कों के धारों मेंहमने तुझको देखा चाँद सितारों मेंबिरहा की अग्नि में पल पल तपती हैंअब तो सांसें तेरी माला जपती हैंतेरे लिए, तेरे लिएतेरे लिए, इस दुनियां काहर सितम है गवारा सनमहो.. हर सितम है गवारा सनमतेरे नाम हम ने किया हैजीवन अपना सारा सनमहो.. जीवन अपना सारा सनमहम्म हम्म..तेरे नाम..तेरे नामतेरे नाम"
387,तेरे नैना बड़े कातिल,romantic,श्रेया घोषाल,"तेरे नैना… नैना… नैना…तेरे नैना… नैना… नैना…क़ातिलाना बड़े नैना नैनातेरे नैना… नैना… नैना…तेरे नैना… नैना… नैना…क़ातिलाना बड़े नैना नैनाक़ातिलाना…क़ातिलाना अदा से एक दिन इस दिल कोहंसाएंगे, रुलाएंगे मार ही डालेंगेतेरे नैना बड़े क़ातिल मार ही डालेंगेगा मा पा सा… सागा मा पा सा… पागा मा पा सा… सागा से रे रेशरारत नैना करते हैंतड़पना दिल को पड़ता हैओ धीरे धीरे हौले हौलेसिलसिला भी बढ़ता हैतेरी यादों कि गर्मी सेमेरा लम्हा पिघलता हैदर्द को तेरी बाहों मेंबड़ा आराम मिलता हैबड़ा आराम मिलता हैक़ातिलाना अदाओं से एक दिन इस दिल कोहंसाएंगे, रुलाएंगे मार ही डालेंगेतेरे नैना बड़े क़ातिल मार ही डालेंगेनैना… क़ातिलाना… नैना रेतेरे एहसास कि ख़ुश्बूमेरी साँसों में बहती हैतेरे दीदार कि ख्वाहिशमुझे दिन रात रहती हैतेरे आने कि आहाट सेमचलते हैं, महकते हैंबिछड़ते हैं तो हर लम्हातेरी ही राह ताकते हैंतेरी ही राह ताकते हैंक़ातिलाना अदाओं से एक दिन इस दिल कोहंसाएंगे, रुलाएंगे मार ही डालेंगेतेरे नैना बड़े क़ातिल मार ही डालेंगेतेरे नैना… नैना… नैना…तेरे नैना… नैना… नैना…क़ातिलाना बड़े नैना नैनातेरे नैना… नैना… नैना…तेरे नैना… नैना… नैना…क़ातिलाना बड़े नैना नैनातेरे नैना… नैना… नैना…तेरे नैना… नैना… नैना…क़ातिलाना बड़े नैना नैनातेरे नैना… नैना… नैना…तेरे नैना… नैना… नैना…क़ातिलाना बड़े नैना नैना"
388,तेरे बिना ज़िन्दगी से,sad,"किशोर कुमार, लता मंगेशकर","तेरे बिना ज़िन्दगी से कोई शिकवा तो नहीं, शिकवा नहीं शिकवा नहीं, शिकवा नहीं तेरे बिना ज़िन्दगी भी लेकिन ज़िन्दगी तो नहीं, ज़िन्दगी नहीं ज़िन्दगी नहीं, ज़िन्दगी नहीं तेरे बिना ज़िन्दगी से कोई शिकवा तो नहीं..  काश ऐसा हो तेरे क़दमों से चुन के मंज़िल चलें और कहीं दूर कह काश ऐसा हो तेरे क़दमों से चुन के मंज़िल चलें और कहीं दूर कह  तुम गर साथ हो मंज़िलों की कमी तो नहीं  तेरे बिना ज़िन्दगी से कोई शिकवा तो नहीं, शिकवा नहीं, शिकवा नहीं, शिकवा नहीं  जी में आता है तेरे दामन में सर छुपा के हम रोते रहें, रोते रहें जी में आता है तेरे दामन में सर छुपा के हम रोते रहें, रोते रहें तेरी भी आँखों में आँसुओं की नमी तो नहीं  तेरे बिना ज़िन्दगी से कोई शिकवा तो नहीं, शिकवा नहीं शिकवा नहीं, शिकवा नहीं तेरे बिना ज़िन्दगी भी लेकिन ज़िन्दगी तो नहीं, ज़िन्दगी नहीं, ज़िन्दगी नहीं, ज़िन्दगी नहीं  तुम जो कह दो तो आज की रात चाँद डूबेगा नहीं रात को रोक ल तुम जो कह दो तो आज की रात चाँद डूबेगा नहीं रात को रोक ल रात की बात है और ज़िन्दगी बाकी तो नहीं  तेरे बिना ज़िन्दगी से कोई शिकवा तो नहीं, शिकवा नहीं शिकवा नहीं, शिकवा नहीं तेरे बिना ज़िन्दगी भी लेकिन ज़िन्दगी तो नहीं, ज़िन्दगी नहीं ज़िन्दगी नहीं, ज़िन्दगी नहीं  तेरे बिना ज़िन्दगी से कोई शिकवा तो नहीं  "
389,तेरे मस्त मस्त दो नैन ,romantic,श्रेया घोषाल,"ताकते रहते तुझको सांझ सवेरे नैनों में बसिया जैसे नैन यह तेरे तेरे मस्त मस्त दो नैन मेरे दिल का ले गये चैन  पहले पहल तुझे देखा तो दिल मेरा धड़का हाए जल जल उठा हूँ मैं शोला जो प्यार का, भड़का हाए नींदों में घूल गये हैं सपने जो तेरे बदले से लग रहे हैं अंदाज़ मेरे  तुझसे शुरू हुई तुझपे ही ख़त्म हो दुनिया मेरी  ये बात दिल में थी, नैनों ने बोल दी, मैं हूँ तेरी  तुझको ही याद कर के आहें भरूँ मैं मिल के ही मिल न पाऊं, अब क्या करूँ मैं माही बे-आप सा, दिल यह बेताब सा, तडपा जाए नैनों के झील में, उतरा था यूँही दिल, डूबा जाए होशों हवास अब तो खोने लगे हैं हम भी दीवाने तेरे होने लगे हैं  "
390,तेरे लिए सिर्फ तेरे लिए,romantic,आतिफ़ असलम,"तू ही बता कौन तू है मेरा कब से तू दिल में रहता है क्या पता  क्यूँ लागे मुझे तेरे बिन ज़िन्दगी एक पल भी कभी पायेगी ना ख़ुशी  तुझको पहचाना मैंने तब जाना की जिंदा हूँ मैं.. तेरे लिए.. सिर्फ तेरे लिए हर पल रहूँ मैं सिर्फ तेरे लिए तेरे लिए.. सिर्फ तेरे लिए हर पल रहूँ मैं सिर्फ तेरे लिए वो.. ओ.. छायी सी है जो आरज़ू दिल पे मेरे क्या वही आरज़ू है तुझको भी घेरे पल जो संग बीते उनकी तस्वीरें रख ले आँखों में यूँ हम दोनों फिर तू कहीं भी हो, लगे पास ही मुझको की जिंदा हूँ मैं.. तेरे लिए.. सिर्फ तेरे लिए हर पल रहूँ मैं सिर्फ तेरे लिए तेरे लिए.. सिर्फ तेरे लिए हर पल रहूँ मैं सिर्फ तेरे लिए वो.. ओ.. की कहा जेह्दी मन दी ऐ गल हाय तू ते हो सकदा ऐ पागल बात मेरी रही अनकही अनसुनी तू समझ ले सनम चाहे मैं कहूं या ना कहूं, हाय.. मैं ते जाना दिल से तेरी हूँ  कल तक हम दोनों अजनबी से थे राहों में आज है तू ही मेरी साँसों में आहों में कोई बतलाये सपने कब छाए पास कब आये यूँ हम दोनों जागा है क्या जादू बस मैं हूँ और बस तू की जिंदा हूँ मैं.. तेरे लिए.. सिर्फ तेरे लिए हर पल रहूँ मैं सिर्फ तेरे लिए तेरे लिए.. सिर्फ तेरे लिए हर पल रहूँ मैं सिर्फ तेरे लिए वो.. ओ.. "
391,तेरे लिए तेरे लिए,romantic,जुबिन नौटियाल ,"मैंने पूछा ये दिल से  मैं क्यूँ हूँ जहाँ में  एक धड़कन बोली तेरे लिए मैंने यादें तराशी  और ख्व़ाब बना दी  नयी दुनिया बसा दी तेरे लिए  तेरे लिए.. तेरे लिए..  तेरे लिए.. तेरे लिए… जो मैं कहता हूँ, जो सुनता हूँ  जो सहता हूँ, तेरे लिए  मैं गिरता हूँ, संभलता हूँ  फिर चलता हूँ, तेरे लिए  कोई दर्द हूँ गहरा  कोई अक्स हूँ पिसर  मैं क्या हूँ बाता दे तेरे लिए  यादों का चेहरा  कोई ख्व़ाब सुनेहरा  मैं क्या हूँ बाता दे तेरे लिए  तेरे लिए.. तेरे लिए..  तेरे लिए.. तेरे लिए.. मैं खोया सा एक लम्हा हूँ  बस इस पल हूँ तेरे लिए  मैं आवारा बादल हूँ  बस इस पल हूँ तेरे लिए  मेरे हर मर्ज़ की तू दुआ है  हुई है कुबूल वो दुआ है  ये उल्फत है या कोई नशा है  जिसे छूना चाहे वो धुंआ है  तेरे लिए.. तेरे लिए..  तेरे लिए.. तेरे लिए… जो मैं कहता हूँ, जो सुनता हूँ  जो सहता हूँ, तेरे लिए.. मैं गिरता हूँ, संभलता हूँ  फिर चलता हूँ, तेरे लिए.."
392,तेरे लिए,sad,लता मंगेशकर,आ.. आ.. दीवाना दीवाना दिल दीवाना दीवाना दिल दीवाना दीवाना दिल दीवाना.. दीवाना..  दिल का आना हाय हाय दिल का जाना हाय हाय दिल का आना हाय हाय दिल का जाना हाय हाय ये आया वो गया जाने कहां खो गया दिल.. दिल परदेसी हो गया दिल.. दिल परदेसी हो गया  दिल का आना हाय हाय दिल का जाना हाय हाय ये आया वो गया जाने कहां खो गया दिल.. दिल परदेसी हो गया दिल.. दिल परदेसी हो गया  आ.. आ..  मेरा दिल अब पास है तेरे तेरा दिल अब पास है मेरे आ.. आ.. मेरा दिल अब पास है तेरे तेरा दिल अब पास है मेरे  मैंने तुमको देखा जबसे मुझको इसपर शक था तबसे एक न एक दिन छोडके मुझको  जायेगा हाँ लो गया.. दिल.. दिल परदेसी हो गया दिल.. दिल परदेसी हो गया  आ.. आ..  एक डगर है बस जाने की राह नहीं वापस आने की एक डगर है बस जाने की राह नहीं वापस आने की हमने देखे प्यार के सपने हम दोनों है दुश्मन अपने  हम दोनों को नींद न आयी सारा जग सो गया.. दिल.. दिल परदेसी हो गया दिल.. दिल परदेसी हो गया     दिल का आना हाय हाय दिल का जाना हाय रे हाय दिल का आना हाय हाय दिल का जाना हाय रे हाय ये आया वो गया जाने कहां खो गया दिल.. दिल परदेसी हो गया दिल.. दिल परदेसी हो गया  आ.. ओ.. हम्म..  दीवाना दीवाना दिल दीवाना दीवाना दिल दीवाना दीवाना दिल दीवाना.. दीवाना.
