index,Song_name,type,artist,lyrics
199,चंदा है तू,romantic,"लता मंगेशकर,रफी",लोगो सु किताब लिखा सब सब प्यार डर नह डर नह डर प्यार नह डर प्यार नह प्यार डर नह डर नह डर प्यार नह डर प्यार नह प्यार डर नह डर नह डर प्यार नह लम्बी दीवारे चुनवा लम्बी दीवारे चुनवा लाख बिठा पहरे लम्बी दीवारे चुनवा लाख बिठा पहरे रस् बिछा ऊँचे पर्वत सागर गहरे रस् बिछा ऊँचे पर्वत सागर गहरे तूफान रुक बादल झुक तूफान रुक बादल झुक उठ उठ प्यार डर नह डर नह डर प्यार नह प्यार छुपे ना खुशबू प्यार छुपे ना खुशबू एलान कहो प्यार छुपे ना खुशबू एलान कहो चुटकी भर सिंदूर मंगा मांग भर चुटकी भर सिंदूर मंगा मांग भर दुन दुन कह दुन दुन कह रह रह प्यार डर नह डर नह डर प्यार नह डर प्यार नह डर प्यार नह 
200,चन्ना मेरेया,sad,अरिजीत सिंह,अच्छा चल दुआओं याद ज़िक्र जुब स्वाद अच्छा चल दुआओं याद ज़िक्र जुब स्वाद दिल संदूक अच्छे काम चिट्ठी तार सलाम अँधेरा उजला सितारा चन् मेरेया मेरेया चन् मेरेया मेरेया चन् मेरेया मेरेया बलिया पिया चन् मेरेया मेरेया चन् मेरेया मेरेया चन् मेरेया मेरेया बलिया पिया मम्म महफ़िल ना ग़म नह ग़म नह किस्से हमारी नजदीक नह नह कित दफा सुबह आँगन बैठे शाम चन् मेरेया मेरेया चन् मेरेया मेरेया चन् मेरेया मेरेया बलिया पिया चन् मेरेया मेरेया चन् मेरेया मेरेया चन् मेरेया मेरेया बलिया पिया रुख रास् मोड़ चला चन्दन खुशबू छोड़ चला मन माया रख तकिये तले बैरागी बैरागी सू चौला ओढ़ चला चन् मेरेया मेरेया चन् मेरेया मेरेया चन् मेरेया मेरेया बलिया पिया 
201,चल घर चलें,sad,अरिजीत सिंह,पल पल संग बित वफ़ सज दिल चाह बत साथ ठिक थक चुके कदम चल चल हमदम होंगे जुदा ना दम चल चल हमदम उम्र प्यार ना चल चल हमदम चल चल हमदम ख़ुशब महके कमरा दर दीवार नह काफी पनाह संग प्यार बस जिसमे चल चल हमदम चल चल हमदम 
202,चल वहां जाते हैं,romantic,अरिजीत सिंह,आसमान परे झूठ सच क़ायदा नह रौश अलग नूर साये जिस्म चल चल प्यार चलो चल चल प्यार चलो सी आके लग ना डर ज़रा पास ना धुन धड़कन सुनो चल चल प्यार चलो चल चल प्यार चलो चल चल प्यार चलो चल चल प्यार चलो चल सुबह रात ना मिले उड़ चलो चल पंख उड़ चलो चल चल प्यार चलो चल चल प्यार चलो 
203,चलती है क्या नौ से बारह,party,नेहा कक्कड़,हैल्लो ब्रोदर आँख लड़ा घायल दिल बेचारा सु चाह १० १२ चाँद चमका क़िस्मत तारा दिल नह भर मुड़ देख दोबारा टन टना टन टन टन टारा टन टना टन टन टन टारा चल नौ बारह १ २ ३ ४ टन टना टन टन टन टारा टन टना टन टन टन टारा चल ९ १२ सु चाह १० १२ खड़ी खड़ी सोच चल जाएँ नौ ग्यारह १ २ ३ ४ टन टना टन टन टना टन टन टन टारा टन टना टन रात शो टिकट खोल पर्स दिखलाऊँ चिपक बैठूं साथ टैक्सी समझ वैसा बटवे पैसा खिल भर गरम समोसा इडली ढोसा चल हट पेप्सी कोला कोका कोला टन टना टन टन टन टारा चल ९ १२ फ़िल्मी धुन देख सीटी रोज़ बजाऊं दिन सोच फिल्म दिखाऊं शुक्रवार शाम हसीन नयी नयी फिल्म गर्मी ना टेंशन थिएटर एयर कंडीशन know फिल्म हसीन जान-ए-मन फिल्म नंबर वन टन टना टन टन टन टारा चल ९ १२ टन टना टन टन टन टारा टन टना टन टन टन टारा चल ९ १२ चल चल आँख लड़ा घायल दिल बेचारा टन टना टन टन टन टारा टन टना टन टन टन टारा आँख लड़ा घायल दिल बेचारा चल ९ १२ चल चल 
204,चलते चलते,romantic,आतिफ़ असलम,चेहरे इश्क ना परदे हटा दे दिल ठिक राह दे मुसाफ़िर मंजिल पास चलूँ राह चल चल चल चल मिल मिल सर-ए-राह चल चल दफ़ा आँख सुकून करीब सफ़र कारव पास बात चल सांस अलग चल चल चल चल मिल मिल सर-ए-राह चल चल सर-ए-राह चल चल 
205,चले आना,sad,अरमान मलिक,याद भूल जाऊँगा हिन्दीट्रैक्स बात दिल ना याद साँस ज़रूरी नह नह भुला बात खुश नह वक़्त रह दिल दीव याद तुम्हारी बात मा मन दिल खुश वैसे भले दूरी जीत निगाह निगाह ख्वाब दुन मिलूँगा रोज सफ़र लौट याद ना ना 
206,चलो चले मिटवा,romantic,कविता कृष्णामूर्ति,चलो मिटवा ऊँची नीची राह प्यारी प्यारी बाह खो नींद जागे चलो मिटवा ऊँची नीची राह प्यारी प्यारी बाह खो नींद जागे लाज रेखा पार प्यार नह नह ा साजन मिलान कान्त खाये रात हाय हाय रैन बिचुआ चलो मिटवा ऊँची नीची राह प्यारी प्यारी बाह खो नींद जागे पलक बिठाके चल चल दुनिया छुपा चल पाँव मीचे सुन सैय्या बैय्या नह नह ा साजन मिलान कान्त खाये रात हाय हाय रैन बिचुआ चलो मिटवा ऊँची नीची राह प्यारी प्यारी बाह खो नींद जागे आग दिल लग नींद नींद याद चाँद पकबाति साथी प्यार बार परसो नह बरसो नह नह ा साजन मिलान कान्त खाये रात हाय हाय रैन बिचुआ चलो मिटवा ऊँची नीची राह प्यारी प्यारी बाह खो नींद जागे लाज रेखा पार प्यार नह नह ा साजन मिलान कान्त खाये रात हाय हाय रैन बिचुआ चलो मिटवा ऊँची नीची राह प्यारी प्यारी बाह खो नींद जागे 
207,चलो चले रे साजन धीरे धीरे,romantic,"हेमंत कुमार, लता मंगेशकर",चलो साजन धीरे धीरे बालम धीरे धीरे सफ़र प्यार खोई खोई येह रात रंगीली नजर नशीली सम इकरार आँख खुशी लहरे दिल मोहब्बत जवान दिल बस प्यार दुनिया प्यार दुनिया गम सुम येह दुनिया खामोश नदी किनारे चाँद पहलू दमन चमक तारे दमन चमक तारे 
208,चाँद कोई होगा तुमसा कहाँ,romantic,"आशा भोसले, किशोर कुमार",चाँद तुमसा देख डाले सात आसमान कहिये चाँद तुमसा देख डाले सात आसमान कहिये चाँद तुमसा देख डाले सात आसमान अजी अजी अजी अजी कहो चुप खड़े अकाद तोह कर छोडो मिल तालके अजी कहो चुप खड़े अकाद तोह कर छोडो मिल तालके मान जानेज चाँद तुमसा देख डाले सात आसमान ना मिल नजर बात इसमे पते वाली ना बोले तोह बोल अब्ब येह पलके काली ना मिल नजर बात इसमे पते वाली ना बोले तोह बोल अब्ब येह पलके काल प्यार केह बोलो बोलो चाँद तुमसा देख डाले सात आसमान चलो हार ना वोह पड़ प्यार इकरार अब्ब तोह खुश ना चलो हार ना वोह पड़ प्यार इकरार अब्ब तोह खुश ना चलो अब्ब चाहे तोह आशिक तुमसा देख डाले सात आसमान कहिये चाँद तुमसा देख डाले सात आसमान कहिये चाँद तुमसा चाँद तुमसा 
209,चाँद मेरा दिल ,romantic,मोहम्मद रफ़ी,चाँद दिल चांद चाँद चांद लौट जान वैसे कदम मिल लोग सनम मिल सच्चा प्यार मुश्किल दिल दोस् खेल नह दिल दिल मिल यार मुश्किल सनम प्यार ठिक चाँद दिल चांद रु रु चाँद चांद रु रु लौट रु रु जान जान 
210,चाँद सिफ़ारिश,romantic,शान,सुभान अल्लाह सुभान अल्लाह सुभान अल्लाह सुभान अल्लाह सुभान अल्लाह सुभान अल्लाह वल्ले वल्ले वल्ले वल्ले वल्ले वल्ले चाँद सिफ़ारिश हमारी दे शर्म-ओ-हया परदे गिरा कर खता वल्ले वल्ले वल्ले वल्ले अदा झोंके वाली गुज़र लचक डाली दिल उतर अदा झोंके वाली गुज़र लचक डाली दिल उतर बाह बह तुझमे फ़ चाँद सिफ़ारिश हमारी दे शर्म-ओ-हया परदे गिरा कर खता सुभान अल्लाह सुभान अल्लाह सुभान अल्लाह सुभान अल्लाह सुभान अल्लाह सुभान अल्लाह ईरादे शरमा धडकन सु घबरा जोगी ईरादे शरमा धडकन सु घबरा जोगी आता नह छुप फ़ चाँद सिफ़ारिश हमारी दे शर्म-ओ-हया परदे गिरा कर खता जिद्द ख़ुद मिट तुझमे फ़ वल्ले वल्ले 
211,चाँद सी महबूबा,romantic,मुकेश,चाँद महबूबा सोचा वैसी सोचा चाँद महबूबा सोचा वैसी सोचा ना कसमे ना रस्मे ना शिकवे ना वादे सूरत भोली भाली नै सीधे साधे रूप ख्याल सोचा वैसी सोचा खुश ना बंटे गम सह चाहे देखे ना ख़्वाब महल दिल रह चाहे दुनिया सोचा वैसी सोचा चाँद महबूबा सोचा वैसी सोचा 
212,चार क़दम,romantic,श्रेया घोषाल,हम्मबिन पुछे पतारस्म रख परेचार कदम चार कदमचल ना साथ मेरेबिन पुछे पतारस्म रख परेचार कदम चार कदमचल ना साथ मेरेबिन बिन सुनेहाथ हाथ लिएचार कदम चार कदमचल ना साथ मेरेहे बिन बिन सुनेहाथ हाथ लिएचार कदम चार कदमचल ना साथ मेरेराह धूप सताएछाँव बिछा हमअंधेरे डर फलक पेचाँद सज़ा हमछ उदासी लतीफ़े सु करतुझको हँसा हमहँस हँस गुनगुनातेचल चार कदमतुमसा मिले रहगुज़रदुनिया डरेचार कदम उमरचल दूँगी साथ तेरेबिन बिन सुनेहाथ हाथ लिएचार कदम चार कदमचल ना साथ मेरेबिन बिन सुनेहाथ हाथ लिएचार कदम चार कदमचल ना साथ 
213,चार बोतल वोडका,party,यो यो हनी सिंह,चार बोतल वोडका काम रोज़ ना रोके ना रोकाचार बोतल वोडका काम रोज़ ना रोके ना रोकाचार बोतल वोडका काम रोज़ ना रोके ना रोका रात दारु पियूं लगातार आधी पी ले पियूं बोतल चार चार बोतल वोडका काम रोज़ ना रोके ना रोका रात हैंगओवर उतार चाह रात हैंगओवर उतार चाह रात हैंगओवर उतार चाह रात हैंगओवर उतार चाह रात हैंगओवर उतार चाह रात हैंगओवर उतार चाह चार बोतल वोडका काम रोज़ ना रोके ना रोक रोके ना रोका ना रोके ना रोका रात दारु सुबह नींबू पा पार्टी वाल कहा पेट भर जित पी बंदी हेल्लो हेल्लो बेबी हाउ मिनट ख़ुद समझ आता साथ क्लब नह आता पीले क्लब नह आता पी लूं ज्यदा मुंह लग कि… चार बोतल वोडका काम रोज़ ना रोके ना रोक रोके ना रोका ना रोके ना रोका रात हैंगओवर उतार चाह रात हैंगओवर उतार चाह रात हैंगओवर उतार चाह रात हैंगओवर उतार चाह रात हैंगओवर उतार चाह रात हैंगओवर उतार चाह सूजी-सूजी आँख देखो लड़क निहार निहार अगले दिन झूमे हैंगओवर देखो लीवर वोडका पुकारे सूजी-सूजी आँख देखो लड़क निहार निहार अगले दिन झूमे हैंगओवर देखो लीवर वोडका पुकारे चार बोतल वोडका काम रोज़ ना रोके ना रोक रोके ना रोका ना रोके ना रोका चार बोतल वोडका काम रोज़ ना रोके ना रोक रोके ना रोका ना रोके ना रोका 
214,चाहिए थोड़ा प्यार,romantic,किशोर कुमार,प्यार प्यार प्यार प्यार प्यार थोड़ा प्यार थोड़ा प्यार थोड़ा प्यार थोड़ा प्यार जानेमन गुल बदन बात मानिये थोड़ा प्यार थोड़ा प्यार प्यार प्यार प्यार प्यार प्यार चोरी छुपे प्यार रुत जवान खो चोरी छुपे प्यार रुत जवान खो जय काली कलकत् वाली वचन ना खाली बच्चा लोग बज ताली थोड़ा प्यार थोड़ा प्यार जानेमन गुल बदन बात मानिये थोड़ा प्यार थोड़ा प्यार जानेमन गुल बदन बात मानिये हँसी ना सका साम नज़र जादू भरी दिल तमन् हसी ना सका साम नज़र जादू भरी दिल तमन् जय काली कलकत् वाली वचन ना खाली छोकरा लोग बज ताली थोड़ा प्यार थोड़ा प्यार जानेमन गुल बदन बात मानिये 
215,चाहूँ मैं या ना,romantic,अरिजीत सिंह,चाहूँ ना दिल चाहूँ ना चाहूँ ना दिल चाहूँ ना चाहत नह इख़्तियार सोचा दिल मिल पूछूँ चाहूँ ना दिल चाहूँ ना ना ख्वाहिश मिल ना कोशिश उलझन सुलझा चाहूँ ना आँखों-आँख जता चाहूँ ना छोटे छोटे ख्वाब ख्वाब गीत गीत ज़िन्दगी चाहत प्रीत देखूँ ख्वाब जिनम मिले खोले होंठ सिले ना उत दिल ऐतबार तन्हा लम्ह बुन सप प्यार पूछ ना चाहूं ना ख़्वाब जी चाहूं ना चाहूँ ना दिल चाहूँ ना 
216,चाहूँगा मैं तुझे,romantic,मोहम्मद रफ़ी,चाहूँगा साँझ सवेरे आवाज़ दूंगा आवाज़ दूंगा चाहूँगा साँझ सवेरे आवाज़ दूंगाआवाज़ दूंगा चाहूँगा साँझ सवेरे देख सुन मन होदेख सुन मन मितवा यार आवाज़ दूंगा दर्द चैन दरस नैन होदर्द चैन दरस नैन मितवा यार आवाज़ दूंगा चाहूँगा साँझ सवेरे आवाज़ दूंगाआवाज़ दूंगा 
217,चिटीयां कलाइयां,party,"मीत ब्रदर्स, अंजान, कनिका कपूर",कल कल लेया गोल्डन झुमके कन् पाव चुम चुम लेया गोल्डन झुमके कन् पाव चुम चुम मन शॉपिंग करा मन रोमांटिक पिक्चर दिखा रिक्विस्ट पाईआं चिटीय कल बेबी चिट्ठ कल चिटीय कल बेबी वाइट कल चिटीय कल बेबी हिस्से आईआं चिटीय कल बेबी चिटीय कल वेमन शॉपिंग करा मन रोमांटिक पिक्चर दिखा रिक्विस्ट पाईआं चिटीय कल बेबी चिट्ठ कल चिटीय कल बेबी वाइट कल चिटीय कल बेबी हिस्से आईआं चिटीय कल बेबी चिटीय कल eah you darling angle baby hite कल drives me crazy hine eyes glitty glitty glittery ou like that akes me going hazzy eah you darling angle baby hite कल drives me crazy hine eyes glitty glitty glittery ou like that akes me going hazzy चढिया रंग रंग ख्वाब संग संग उडदी फिर रात उडदी फिर बदले जिंदड़ी रंग ढंग नींद तंग तंग उडदी फिर रात उडदी फिर मन गुलाबी चुन् दिवा मन कलरफुल चूड़ी पवा रिक्विस्ट पाईआं चिटीय कल बेबी चिटीय कल चिटीय कल बेबी वाइट कल चिटीय कल बेबी हिस्से आईआं चिटीय कल बेबी चिटीय कल घुमड़े फिरदे सीट मिल्क चिटीय कल कल हाथ चुमदा रेह्न्दा फब लिय चिटीय चिटीय मन शॉपिंग करा मन रोमांटिक पिक्चर दिखा रिक्विस्ट पाईआं चिटीय कल बेबी चिटीय कल चिटीय कल बेबी वाइट कल चिटीय कल बेबी हिस्से आईआं चिटीय कल बेबी चिटीय कल 
