index,Song name,type,artist,lyrics
194,गोविंदा आला रे,party,मोहम्मद रफ़ी,गोविंदा आला रे आला ज़रा मटकी सम्भाल बृजबाला गोविंदा आला रे आला ज़रा मटकी सम्भाल बृजबाला अरे एक दो तीन चार संग पाँच छः सात हैं ग्वाला अरे एक दो तीन चार संग पाँच छः सात हैं ग्वाला गोविंदा आला रे आला ज़रा मटकी सम्भाल बृजबाला हे.. हो आई माखन के चोरों की सेना हो आई माखन के चोरों की सेना हो ज़रा बच के सम्भल के जी रहना हो ज़रा बच के सम्भल के जी रहना बड़ी नटखट है फ़ौज कहीं आई जो मौज बड़ी नटखट है फ़ौज कहीं आई जो मौज नहीं बचने का नहीं बचने का कोई भी ताला ताला  गोविंदा आला रे आला ज़रा मटकी सम्भाल बृजबाला गोविंदा आला रे आला ज़रा मटकी सम्भाल बृजबाला होय..   हो कैसी निकली है झूम के ये टोली हो कैसी निकली है झूम के ये टोली आज खेलेगी दूध से ये होली हो आज खेलेगी दूध से ये होली भींगे कितना भी अंग ठंडी हो ना उमंग भींगे कितना भी अंग ठंडी हो ना उमंग पड़े इनसे ओ पड़े इनसे किसी का न पाला पाला  गोविंदा आला रे आला ज़रा मटकी सम्भाल बृजबाला गोविंदा आला रे आला ज़रा मटकी सम्भाल बृजबाला अरे एक दो तीन चार संग पाँच छः सात हैं ग्वाला अरे एक दो तीन चार संग पाँच छः सात हैं ग्वाला  गोविंदा आला रे आला ज़रा मटकी सम्भाल बृजबाला  अरे एक दो तीन चार संग पाँच छः सात हैं ग्वाला अरे एक दो तीन चार संग पाँच छः सात हैं ग्वाला  गोविंदा आला रे आला ज़रा मटकी सम्भाल बृजबाला गोविंदा आला रे आला ज़रा मटकी सम्भाल बृजबाला आला रे आला.. ज़रा मटकी सम्भाल बृजबाला ओ.. गोविंदा आला रे आला ओ.. आला रे आला..
195,घर भरा सा लगे,romantic,पोपोन,कुछ ना होने का दुःख ज़रा सा लगे ज़रा सा लगे कुछ ना होने का दुःख ज़रा सा लगे ज़रा सा लगे तेरे होने से तेरे होने से तेरे होने से घर भरा सा लगे घर भरा सा लगे  तेरी ख़ुशबू है घर की रग रग में तेरी परछायी में है सौ नगमें इश्क़ ने दिए हैं जो ख़ुश होके तेरे बोसे तो है मेरे तग़ में  अच्छी आदत मेरी सिर्फ़ तुम हो मानो इज़्ज़त मेरी सिर्फ़ तुम हो  बिन तेरे वक़्त भी बुरा सा लगे बुरा सा लगे कुछ ना होने का दुःख ज़रा सा लगे ज़रा सा लगे  तेरे पहलू में रखना है सर को तेरी नज़रों से देखेंगे घर को मैंने गहनों सा पहना है देखो तेरी चाहत तेरे आदर को  ऐश-ओ-इशरत मेरी सिर्फ़ तुम हो सारी दौलत मेरी सिर्फ़ तुम हो  बिन तेरे घर भी मक़बरा सा लगे मक़बरा सा लगे  कुछ ना होने का दुःख ज़रा सा लगे ज़रा सा लगे  तेरे होने से तेरे होने से तेरे होने से घर भरा सा लगे..
196,घर से निकलते ही,romantic,अरमान मलिक,पहली दफ़ा मैंने जब उसको देखा था सांसें गयी ये ठहर रहती है दिल में मेरे कैसे बताऊँ उसे मैं तो नहीं कह सका कोई बता दे उसे घर से निकलते ही कुछ दूर चलते ही रस्ते में है उसका घर उसकी गली में है ढली कितनी ही शामें मेरी देखे कभी वो जो मुझे खुश हूँ मैं इतने में ही मैंने तरीके सौ आजमाए जाके उसे ना कुछ बोल पाए .. बैठे रहे हम रात भर जो पास जाता हूँ सब भूल जाता हूँ मिलती है जब ये नज़र घर से निकलते ही कुछ दूर चलते ही रस्ते में है उसका घर कल जो मिले वो राहों में तो मैं उसे रोक लूं उसके दिल में क्या है छिपा इक बार मैं पूछ लूं पर अब वहाँ वो रहती नहीं है मैंने सुना है वो जा चुकी है खाली पड़ा है ये शहर मैं फिर भी जाता हूँ सब दोहराता हूँ शायद मिले कुछ खबर हो.. हम्म.. घर से निकलते ही कुछ दूर चलते ही रस्ते में है उसका घर
197,घुंघरू,party,"अरिजीत सिंह, शिल्पा राव","क्यूँ लम्हें खराब करें आ गलती बेहिसाब करें दो पल की जो नींद उड़ी आ पूरे सारे ख़्वाब करें  क्या करने है उमरों के वादे ये जो रहते हैं रहने दे आधे दो बार नही एक बार सही एक रात की कर ले तू यारी  सुबह तक मान के मेरी बात तू ऐसे ज़ोर से नाची आज हिन्दीट्रैक्स कि घुँघरू टूट गये कि घुँघरू टूट गये  छोड़ के सारे शर्म और लाज मैं ऐसे ज़ोर से नाची आज कि घुँघरू टूट गये कि घुँघरू टूट गये  दिल लेना, दिल लेना जरूरी नहीं है इन बातों के सिवा भी बातें कई है १ लम्हें से जयदा की ख्वाहिश नहीं है फिर चाहे दोबारा न मिलना कही  मेरे सपने नहीं सीधे-साधे है गलतफेहमियाँ तो मिटा दे दो बार नही एक बार सही एक रात की कर ले तू यारी  सुबह तक मान के मेरी बात तू ऐसे ज़ोर से नाची आज कि घुँघरू टूट गये कि घुँघरू टूट गये  छोड़ के सारे शर्म और लाज मैं ऐसे ज़ोर से नाची आज कि घुँघरू टूट गये कि घुँघरू टूट गये  इश्क़ है आज बस, कल करना भी नहीं दिल में ठेरना तो है, पर उतरना भी नहीं मिटना भी है कुछ देर के लिए  पूरी उम्र तुमपे मरना भी नहीं  क्या करने है उमरों के वादे ये जो रहते हैं रहने दे आधे दो बार नही एक बार सही एक रात की कर ले तू यारी  सुबह तक थाम के तेरा हाथ तू ऐसे ज़ोर से नाची आज कि घुँघरू टूट गये कि घुँघरू टूट गये  छोड़ के सारे शर्म और लाज मैं ऐसे ज़ोर से नाची आज कि घुँघरू टूट गये कि घुँघरू टूट गये  टूट गये कि घुँघरू टूट गये टूट गये कि घुँघरू टूट गये"
198,घूँघट की आड़ से,romantic,"अलका याग्निक, कुमार सानू","घूँघट की आड़ से दिलबर का दीदार अधुरा रहता है घूँघट की आड़ से दिलबर का दीदार अधुरा रहता है जब तक ना पड़े आशिक की नज़र जब तक ना पड़े आशिक की नज़र सिंगार अधुरा रहता है घूँघट की आड़ से दिलबर का घूँघट की आड़ से दिलबर का दीदार अधुरा रहता है जब तक ना पड़े नज़रों से नज़र जब तक ना पड़े नज़रों से नज़र इकरार अधुरा रहता है घूँघट की आड़ से दिलबर का दिलबर का, दिलबर का, दिलबर का दिलबर का, दिलबर का, दिलबर का गोर मुखड़े से घुंघटा हटाने दे घडी आपने मिलन की तो आने दे मेरे दिल पे नहीं मेरा काबू है कुछ नहीं ये तो चाहत का जादू है बढती ही जाती है सनम प्यार की ये बेखुदी हो.. दो प्रेमियों के ना मिलने से संसार अधुरा रहता है जब तक ना पड़े नज़रों से नज़र जब तक ना पड़े नज़रों से नज़र इकरार अधुरा रहता है घूँघट की आड़ से दिलबर का दिलबर का, दिलबर का, दिलबर का हाँ दिलबर का, दिलबर का, दिलबर का बाग में गुल का खिलना ज़रूरी है हाँ मोहब्बत में मिलना ज़रूरी है पास आने का अच्छा बहाना है क्या करूँ मैं की मौसम दीवाना है दिल मेरा धड़कने लगी अब तो ये दीवानगी हो बिना किसी यार के जानेजा ये प्यार अधुरा रहता है जब तक ना मिले नज़रों से नज़र जब तक ना मिले नज़रों से नज़र इकरार अधुरा रहता है घूँघट की आड़ से दिलबर का घूँघट की आड़ से दिलबर का दीदार अधुरा रहता है जब तक ना पड़े आशिक की नज़र सिंगार अधुरा रहता है घूँघट की आड़ से दिलबर का दिलबर का, दिलबर का, दिलबर का दिलबर का, दिलबर का, दिलबर का हाँ दिलबर का, दिलबर का, दिलबर का हाँ दिलबर का, दिलबर का, दिलबर का दिलबर का, दिलबर का, दिलबर का हो दिलबर का, दिलबर का, दिलबर का हाँ दिलबर का, दिलबर का, दिलबर का दिलबर का, दिलबर का, दिलबर का"
199,चंदा है तू,romantic,"लता मंगेशकर,रफी",ओ.. ओ.. लोगो से सुना है किताबों में लिखा है सबने यही कहा है सबने यही कहा है  प्यार करने वाले कभी डरते नहीं हाँ डरते नहीं जो डरते हैं वो प्यार करते नहीं जो डरते हैं वो प्यार करते नहीं  प्यार करने वाले कभी डरते नहीं हाँ डरते नहीं जो डरते हैं वो प्यार करते नहीं जो डरते हैं वो प्यार करते नहीं  प्यार करने वाले कभी डरते नहीं हाँ डरते नहीं जो डरते हैं वो प्यार करते नहीं  आ.. आ.. ओ.. ओ..  लम्बी दीवारे चुनवा दो लम्बी दीवारे चुनवा दो लाख बिठा दो पहरे  लम्बी दीवारे चुनवा दो लाख बिठा दो पहरे रस्ते में बिछा दो ऊँचे पर्वत सागर गहरे  रस्ते में बिछा दो ऊँचे पर्वत सागर गहरे  तूफान कब रुकते हैं बादल जब झुकाते हैं तूफान कब रुकते हैं बादल जब झुकाते हैं सारे कह उठते सारे कह उठते  प्यार करने वाले कभी डरते नहीं हाँ डरते नहीं जो डरते हैं वो प्यार करते नहीं  प्यार छुपे ना खुशबू प्यार छुपे ना खुशबू ये एलान कहो तो कर दूं प्यार छुपे ना खुशबू ये एलान कहो तो कर दूं  चुटकी भर सिंदूर मंगा दे मांग मैं तेरी भर दूं चुटकी भर सिंदूर मंगा दे मांग मैं तेरी भर दूं  हम्म.. दुनियां क्या कर लेगी दुनियां से कहेगी दुनियां क्या कर लेगी दुनियां से कहेगी बस कहती ही रहेगी बस कहती ही रहेगी  प्यार करने वाले कभी डरते नहीं हाँ डरते नहीं जो डरते हैं वो प्यार करते नहीं जो डरते हैं वो प्यार करते नहीं जो डरते हैं वो प्यार करते नहीं..
200,चन्ना मेरेया,sad,अरिजीत सिंह,अच्छा चलता हूँ दुआओं में याद रखना मेरे ज़िक्र का जुबां पे स्वाद रखना अच्छा चलता हूँ दुआओं में याद रखना मेरे ज़िक्र का जुबां पे स्वाद रखना  दिल के संदूकों में मेरे अच्छे काम रखना चिट्ठी तारों में भी मेरा तू सलाम रखना  अँधेरा तेरा मैंने ले लिया मेरा उजला सितारा तेरे नाम किया  चन्ना मेरेया मेरेया चन्ना मेरेया मेरेया चन्ना मेरेया मेरेया बलिया ओ पिया.. चन्ना मेरेया मेरेया चन्ना मेरेया मेरेया चन्ना मेरेया मेरेया बलिया ओ पिया..  मम्म.. महफ़िल में तेरी हम ना रहे जो ग़म तो नहीं है ग़म तो नहीं है किस्से हमारी नजदीकियों के कम तो नहीं है कम तो नहीं है  कितनी दफा सुबह को मेरी तेरे आँगन में बैठे मैंने शाम किया  चन्ना मेरेया मेरेया चन्ना मेरेया मेरेया चन्ना मेरेया मेरेया बलिया ओ पिया.. चन्ना मेरेया मेरेया चन्ना मेरेया मेरेया चन्ना मेरेया मेरेया बलिया ओ पिया.. तेरे रुख से अपना रास्ता मोड़ के चला.. चन्दन हूँ मैं अपनी खुशबू छोड़ के चला..  मन की माया रख के तेरे तकिये तले बैरागी बैरागी का सूती चौला ओढ़ के चला  चन्ना मेरेया मेरेया चन्ना मेरेया मेरेया चन्ना मेरेया मेरेया बलिया ओ पिया..
201,चल घर चलें,sad,अरिजीत सिंह,पल पल मेरा तेरे ही संग बिताना है अपनी वफ़ाओं से तुझे सजाना है दिल चाहता है तुझे कितना बताना है हाँ तेरे साथ ही मेरा ठिकाना है अब थक चुके हैं ये कदम चल घर चलें मेरे हमदम होंगे जुदा ना जब तक है दम चल घर चलें मेरे हमदम ता उम्र प्यार ना होगा कम  चल घर चलें मेरे हमदम मेरे रहो तुम और तेरे हम चल घर चलें मेरे हमदम  ख़ुशबुओं से तेरी महके हर एक कमरा दरों दीवार नहीं काफी है तेरी पनाह संग तेरे प्यार का जहां बसाना है  जिसमे रहें तुम और हम चल घर चलें मेरे हमदम मेरे रहो तुम और तेरे हम चल घर चलें मेरे हमदम
202,चल वहां जाते हैं,romantic,अरिजीत सिंह,"आसमान के परे एक जहां है कहीं झूठ सच का वहां क़ायदा ही नहीं रौशनी में वहां की अलग नूर है साये जिस्मों से आगे जहां जाते हैं  चल वहां जाते हैं  चल वहां जाते हैं  प्यार करने चलो  हम वहां जाते हैं चल वहां जाते हैं  चल वहां जाते हैं  प्यार करने चलो  हम वहां जाते हैं  सीने से तुम मेरे आके लग जाओ ना डरते हो क्यों ज़रा पास तो आओ ना धुन मेरी धड़कन की सुनो..  चल वहां जाते हैं  चल वहां जाते हैं  प्यार करने चलो  हम वहां जाते हैं चल वहां जाते हैं  चल वहां जाते हैं  प्यार करने चलो  हम वहां जाते हैं चल वहां जाते हैं  चल वहां जाते हैं  प्यार करने चलो  हम वहां जाते हैं चल वहां जाते हैं  चल वहां जाते हैं  प्यार करने चलो  हम वहां जाते हैं  ओ.. जाते हैं, चल वहां जाते हैं  जाते हैं.. जाते हैं..  कोई सुबह वहां रात से ना मिले उड़ के वहां चलो आओ तुम हम चलें पंख लाया हूँ मैं उड़ चलो..  चल वहां जाते हैं  चल वहां जाते हैं  प्यार करने चलो  हम वहां जाते हैं चल वहां जाते हैं  चल वहां जाते हैं  प्यार करने चलो  हम वहां जाते हैं "
